ID,Text,Label
4878,"рдЖрд░рдВрдн рд╕реЗ рд▓реЗрдХреЗ рдЕрдВрдд рддрдХ рдлрд┐рд▓реНрдо рдЕрдЪреНрдЫреА рд▓рдЧреА рд▓реЗрдХрд┐рди рд╕рдордЭрдиреЗ рд╡рд╛рд▓реА рдмрд╛рдд рдпреЗ рд╣реИ рдХрд┐ рдЕрдЧрд░ 100
рд▓рдбрдХрд┐рдпреЛ рдХрд╛ рд░реЗрдк рд╣реЛрддрд╛ рд╣реИ рддреЛ 95 рд▓рдбрд╝рдХрд┐рдпрд╛рдВ рд╕рд╛рдорд╛рдЬрд┐рдХ рдкрд╛рд░рд┐рд╡рд╛рд░рд┐рдХ рджрдмрд╛рд╡ рдХреЗ рдХрд╛рд░рдг рдЗрд╕ рд░реЗрдк рдХрд╛
рдЦреБрд▓рд╛рд╕рд╛ рдирд╣реАрдВ рдХрд░ рдкрд╛рддреА ,  
рдмрд╛рдХреА 5 рдореЗрдВ рд╕реЗ 3 рд▓рдбрдХрд┐рдпреЛ рдХрд╛ рд░реЗрдк рд╕рд╛рдмрд┐рдд рдирд╣реАрдВ рд╣реЛ рдкрд╛рддрд╛ рдФрд░ рдмрд╛рдХреА 2 рдореЗрдВ 1 рд░реЗрдк рдХреЗрд╕ рдЗрд╕
рддрд░рд╣ рдХрд╛ рд╣реЛрддрд╛ рд╣реИ  
рдЗрд╕ рдлрд┐рд▓реНрдо рдХреА рдХреЛ рд╕рдмрд╕реЗ рдЧрдВрджреА рдмрд╛рдд рд▓рдЧреА рд╡реЛ рдпрд╣реА рд▓рдЧреА рдХреА рдЗрд╕рдореЗрдВ рдЙрд╕ рдПрдХ рд▓рдбрд╝рдХреА рдмрд╛рдд рдХреА рдЧрдИ рд╣реИ
рдЬреЛ рдЭреВрдард╛ рдХреЗрд╕ рдХрд░рдХреЗ рдлрдВрд╕рд╛рдирд╛ рдЪрд╛рд╣рддреА рд╣реИ рдмрд╛рдХреА рдирд╛ рддреЛ рдЙрди 95 рд▓рдбрдХрд┐рдпреЛ рдХреА рдмрд╛рдд рдХреА рдЧрдИ рдЬреЛ
рд╕рд╛рдорд╛рдЬрд┐рдХ рджрдмрд╛рд╡ рдХреЗ рдХрд╛рд░рдг рдХреЛрд░реНрдЯ рдирд╣реАрдВ рдЬрд╛ рд╕рдХреА рдФрд░ рдирд╛ рд╣реА рдЙрди рддреАрдиреЛрдВ рдХреА рдмрд╛рдд рдХреА рдЧрдИ рдЬреЛ рдкреИрд╕реЗ
рдФрд░ рдЕрдЪреНрдЫреЗ рд╡рдХреАрд▓ рдХреЗ рдЕрднрд╛рд╡ рдХреЗ рдХрд╛рд░рдг рдЗрд╕ рдХреЗрд╕ рдХреЛ рдЬреАрдд рдирд╣реАрдВ рд╕рдХреА рдмрджрд▓реЗ рдореЗрдВ рдЕрдкрдиреЗ рдХреБрдЪрд░рд┐рддреНрд░ рдХрд╛
рдкреНрд░рдорд╛рдгрдкрддреНрд░ рдЕрд▓рдЧ рд╕реЗ рд▓реЗ рдмреИрдареА  
рдЦреИрд░ рдХреЛрдИ рдмрд╛рдд рдирд╣реАрдВ рдлрд┐рд▓реНрдо рдиреЗ рддреЛ рджрд┐рдЦрд╛ рджрд┐рдпрд╛ 100% рдмрд▓рд╛рддреНрдХрд╛рд░ рдХреЗ рдХреЗрд╕ рдмрджрдирд╛рдо рдХрд░рдиреЗ рдХреЗ рд▓рд┐рдП
рд╣реЛрддреЗ рд╣реИрдВ  
  
  
рджреБрдирд┐рдпрд╛ рдореЗрдВ рдХреЛрдИ рдРрд╕рд╛ рдирд┐рдпрдо рдирд╣реАрдВ рдЬрд┐рд╕рдХреЛ рддреЛрдбрд╝рд╛ рдирд╛ рдЬрд╛ рд╕рдХреЗ ред  
рдХреНрдпрд╛ 2% рдХреЗрд╕ рдЧрд▓рдд рд╣реЛрдиреЗ рдХреА рд╡рдЬрд╣ рд╕реЗ рд╣рдо рдЗрд╕ рдирд┐рдпрдо рдХреЛ рд╣реА рдЧрд▓рдд рдорд╛рди рд▓реЗ рдпрд╛ рдпреЗ рдорд╛рди рд▓реЗ рдХреА рд░реЗрдк
рд╣реЛрддреЗ рд╣реА рдирд╣реАрдВ ?",0
4435,"BRITISH ARMY me yeh homosexual rights ke pravdhan hai jo 2000 me start hui thi
aur aab vahan ke liberal media aur nationalist jaise Tommy Robinson iski
khilafat kar rahe hai, unka manana hai ki iss tarah ki policies British Army
ko GAY ka adda bana rahi hai aur unko apne actual duty se bhatka rahe hai.  
Proud of you BIPIN RAWAL sir we proud of you for straight and clear rejection.
Jinko Pubg or Gay dating karni hai border pe vo dur rahe Disciplined Army se.",1
2524,gayhind,0
5716,"tum log movie ko movie ki trha kyu nhi lete??? bc har baat p kya aag lg jati h
tumhe?? kisne kha tha movie dekhne ko??? ye chutiya aaurat to bkwaas chod rhi
h bc shahid n ase ko shi jawab diya thaa ase ko baat baat in feministo ki gand
m aag lg jaati h are jao lgi aag to gand marao no body gives a fuck about uh",1
5584,"hats off this is the first time... ki kch different aya h and jo so called
chutiye feminism wale log h unko ye zarur dekhna chahiye ki har rape hua mein
galti ladke ki ni hoti and aj ki date me maximum females fake case krti h bcz
they know govt will support them",1
783,"Jatt wale ko do lagao aur teedha kar do, so [simple.lol](http://simple.lol/)",0
17,"рдпрд╣ рдПрдХ рд╕рдВрд╡реЗрджрдирд╢реАрд▓,рдХрдареЛрд░,рд╕рдирдХ, рдмреЗрдкрд░рд╡рд╛рд╣, рджрд░реНрдж рджреЗрдиреЗ рд╡рд╛рд▓рд╛,рдкреНрд░реЗрдо рдХрд╣рд╛рдиреА рд╣реИ",0
1993,рд╕рд╣реА рдмрд╛рдд рдХрд╣реА,0
1847,Aman Dhillon KYA HUA BHAI JI SAB THIK HAI NA AB? PLZZ MAKE CONTACT,0
2272,Chutiya das,0
4936,"aap bohot mata pita ke aadar mata pita ke adar bolke rote hain na, yaha pe
kabir preeti ke papar ko toh bohot aadar karte the.feminism baat ko samhiye.
aur apka propaganda na jake dusro ko bechiye. bohot biased hain aur bohot
hypocrit hain aap",0
1996,"Liberaly ki nd feminists ki jl gyi hogi buri trh se, kher unki ookat hi yhi h",0
3389,"Homosexuality ko except karna modernisation ni h balki cosmopolitan banna h
(open minded hona) hai  
Samje!!",0
4710,Mc kon unlike krta h,1
2399,Aapki sari videos mst hoti h bhai,0
624,Ap sahi bol rhe h sb faltu h,0
946,@crazy Ram aap apna whatspp no dijiye,0
6109,"bhag teri maa ki chut bhen ki lodhi  
lakshya chaudary ne to bss ЁЯШВЁЯШВ chod dala salli ko",1
314,"Koi stud teri behen ko college meh chumma deta h bina uski ijazat k ....toh
tereko chalega kya?",1
474,"Bhaiya maine bhi apne dosto ko yahi bola ki kuch nahi h wahi story ko baar
baar naye chehro ke saath dikhaya jata h par mere chutiye dost to movie dekh
ke pagal se ho gye the",0
5935,"ye pehle ladka apne ghar ka sher tha bad me iske ghar k feminist o ne milke
ise **5 kg makeup wali uncle me badal diya**
[#rip](http://www.youtube.com/results?search_query=%23rip)_uncle_suchitra",1
2691,"[3:26](https://www.youtube.com/watch?v=N_ZMfQMZos0&t=3m26s) Kutte ki tarah
pyaar krti/ krta hain ЁЯШЖЁЯШВ wtf broЁЯдг",0
1648,"Desh me jab tak senema hai  
Log chutiye bante rahenge  
[#Ramadhir](http://www.youtube.com/results?search_query=%23Ramadhir) sing ЁЯШВЁЯШВЁЯШВ",0
1579,Ye kutta na sab ko apna jesa banayega...is channel ko strike marna hoga !,0
5660,"tumhari maa ka bhadosa  
kabir singh rocks .  
[#lakshaychaudhary](http://www.youtube.com/results?search_query=%23lakshaychaudhary)
army",1
2096,"Are bhikhari ki bacha khub jol tu bhik mangegi .sali beiman ourat tu moregi
.kutta jaisa teri awaz niklegi .",0
5500,"рдбреЙрдХреНрдпреВрдореЗрдВрдЯрд░реА рдХрд╛ рдореЗрдВрди рдЙрджреНрджреЗрд╢реНрдп рдпреЗ рд╣реИ рдХрд┐ рдЕрдЧрд░ рдХреЛрдИ рдмреЗрдЧреБрдирд╛рд╣ рдЖрджрдореА рдлрд╕ рдЧрдпрд╛ рд╣реИ рддреЛ рдмрдЧреИрд░
рдкрдмреНрд▓рд┐рдХ рд╕рдкреЛрд░реНрдЯ рдХреЗ рд╡реЛ рдмрд╛рд╣рд░ рдирд╣реА рдЖ рд╕рдХрддрд╛ редрдпреЗ рд╣реИ рдЗрдВрдбрд┐рдпрд╛ рдХрд╛ рдХрд╛рдиреВрди",0
5831,chutiyaa,0
4027,Gay log ladko ka part pakhadne mein jyada interest rakhte hain,1
2385,well done sabhi ko yesa hi karna chahiye tabhi ye kanoon badlega,0
836,"Ap ap apne videos me English subtitles sammilit kare. Isse apke muluayvan vani
pure brahmand me prakaashit hogi. Bharat varsh ap jaisi tejsavi yuva atma ke
karan jagat guru banega. Sraday apka dhanyavaad. Mujhe ap par puri shraddha
hai ki ap English me subtitles rakhege.",0
5539,"ladkia kitne saalo se ye sab jhelti aa ri h kisi ne nai suna per 6-7 saal me
hi ladko ki hawa tight ho gai. naarebazi kr re the..band karo band karo...
itni awareness or shiddat ladkio k rape cases me b dikhai hoti to accha hota
per wahi h.. jaise kuch gande admio ki wajah se sabhi aadmi badnaam hue waise
hi kuch buri ladkio ki wajah se sabhi ladkia badnaam ho jati hn. is cheez ka
balance kabhi nai ho skta. or ye comment pe b gali dene aayenge kuch ladke ki
kaisi soch h.. ye wo...unke liye yahi kehna h bas ki fir aapko mera comment
samjh hi nai aaya. soch to meriyahi h ki equality honi chahiye. jo ladke fayde
utthate hn mere liye wo b bure or jo ladkia fayda utthati hn mere liye wo b
buri. but ek fact tha bas ki jb sar sa pani utar jata h tb ja k kuch hota h
india me or isi chakkar me kai masoom log pis jate hn tab tak.",0
1217,Coat ka collection kafi accha hai.. тЬМ,0
4290,Rly yaad hay ki bhul gaye,0
1165,Bhadwa borade ЁЯШВ,0
5108,"i request all women please aisa mt kia kro innocent logo k sath bcoz apke krn
log sach p belive krna bnd kr dege please dont do this ЁЯЩПЁЯЩПЁЯЩП",0
4090,"Bhai kl se active ho gya h kya bat h ..  
Pehle kha the bhai kya KR rhe the",0
1465,Hii.kaise.ho,0
5833,bakwaas reviewer,0
2791,Serious na le vo sirf ek movie thi...sanju movie sbse chutiya ajtak ki,0
4398,рдУ рд╕реНрддреНрд░рд╛ рддреБрдо рднрд┐ friendship рд╣рд╛рдореНрд╕реЗ lop рдХрд░реЛрдЧреЗ?,0
1821,Pratik bhai inn liberals ki mkb,1
138,"рдЦрд╛рдЬрджреАрдк рдФрд░ рд░рдгреНрдбреА рдЕрдВрджрд╛рддреА рд░рд╛рдп рджреЛрдиреЛрдВ рдХреА рдорд╛рдВ рдЪреБрджреЗрдЧреА рдпрд╛рдж рд░рдЦрдирд╛ рдХрд┐рддрдиреА рдмрд╛рд░ рдЗрдирдХреЗ рдЧрд╛рд▓ рдкреАрдЯ
рджрд┐рдП рдкрд░ рдмреЗрд╢рд░реНрдо рд╣реИред рд▓рдВрдж рдЬреАрддреЗрдЧреА рд╡рд┐рдЪрд╛рд░ рд╕реЗ рддреЛ рдкрд╛рдХ рдХреА рд░рдЦреИрд▓ рд╣реИ рднреЛрд╕рдбреАрдХреЗ",1
1211,"bilkul sahi kera kuch bhi galat nahi Kiya usna . maan saaman sa jub loog na
jeena da to Aisa kerna vala hai",0
2223,Kyu tum toxic masculinity ke saath cope up karsati kya,0
2741,"wo bhi chutiya tum bhi chutiya ...ye Bollywood aur media mil ke sabko chutiya
bna rha hey....par kabir singh thik hi lga.... entertainment....mze lo...yar",0
2296,Arnab,0
928,"TUM EK LARKI KO THAPPAR MARTE HO FIR RAPE KRTE HO AUR CLASS K SABKE SAAMNE KHE
HO KI YEH MERI BANDI HAI YEH KYA HAI",0
746,"Seedha sa ek law bana deejeyey ki agar ye proof hota hai ki agar wife key
allegations galat saabit hotey hain chahey usmain kitna hi time Lacey....lekin
agar ye saabit ho ki allegations galat hain to WIFE KO JAIL HOGI ....",0
2902,T shirts khab badli karoge,0
3665,"Kya bhosdi ke, baat to sahi kr rha h pr kya koi sun rha h",1
1244,Jio bhai,0
1232,Jio bro,0
5495,@shashank verma link bhejiye janab,0
5796,abey jana sali. mc ki . kuch bhi bhonk ri h. dekh le dhng se movie ko.,1
62,"Kisi bhi movie ka vastabik review aap se behetar kohi karhinahisakta. Aap ko
movie review ka oscar milna chahiye. Thanks a lot",0
2779,Gosde Murdabad .,0
4372,JOKER ЁЯдб movie ke bare me kuch bolo,0
4092,рднрд╛рдИ рдЖрдк great рд╣реЛ,0
1243,"Muze lagta hay ki Bharat me sabki jine ka Adhikar hona chahiye.aur sabko Desh
ki seva karneka mouka milna chahiye.kya pata? Mahabharat ki tarah kisi Jang me
koi shikhadi mile aur wo Jang jitale?",0
6104,"oye bhosadey jese shakal ki... behen ki lodi.. bolne se pehle.. teri gaand me
kisi me garam tel daal diya tha kya?",1
3329,"реЮрд┐рд▓реНрдо рдореЗрдВ рдПрдХ рдХрдореА рд▓рдЧреА рдХрд┐ рд╕рдВрд╡рд╛рдж рдЗрдВрдЧреНрд▓рд┐рд╢ рдореЗрдВ рдереЗред рдЙрд╕реЗ рд╕рдордЭрдиреЗ рдХреА рджрд┐рдХреНрдХрдд рдирд╣реА рд▓реЗрдХрд┐рди
рдЗрдВрдЧреНрд▓рд┐рд╢ рд╣рд┐рдВрджреА рдХрд╛ рдорд┐рдХреНрд╕рдЪрд░ рд╕рд╣реА рдирд╣реА рд▓рдЧрддрд╛ред  
рдЕрдХреНрд╖рдп рдЦрдиреНрдирд╛ рдХреЗ рдЯреИрд▓реЗрдВрдЯ рдХреА рдХрджреНрд░ рдХрдо рд▓реЛрдЧ рд╣реА рдХрд░рддреЗ рд╣реИред рдкреВрд░рд╛ рдЬрд┐рдВрдЭреЛреЬ рдХреЗ рд░рдЦ рджрд┐рдпрд╛ред",0
823,"Chal bhaaag yha se.....  
Maa bahan beti h...?",0
780,good morning beti,0
3055,Ye log film na hi app ki ye video dekhe to mane ge.,0
5174,"rape victims to victim hoti hai tab bhi sabse pehle usko uske maa, baap, bhai,
rishtedaar, padosi taane maar maar ke maar dalte hain. pehle to vo complaint
karti he nahi aur agar kar de to court me beizzat ho, aadmi ko to koi bolta he
nai kuch. koi na beta koi na jab aurat itne saalon se tumhare zulm seh rahi
hai thoda tum logon ne seh liya to koi badi baat naa hai. pata ni jitni
begunaah airten aadmiyon ke zulm sehti aayi hain, thoda tum bhi seh lo. jaise
ko taisa kabhi na kabhi to milna he tha. i salute to those women jo aaiyon ka
shikaar karti hain. good job done.",1
2963,Ye tum meme se padh ke aye ho hero mt bno,0
3508,Ranga aur billa ki sarkaar hain...........!,0
5468,"тАЬshaadi ka jhansa deke rape kiyaтАЭ .. esa bolne wali ladki ko jail vejna
chaiye..",0
1592,рдмрдХрд╡рд╛рд╕ реЮрд┐рд▓реНрдо рдХрдмреАрд░ рд╕рд┐рдВрд╣,0
4,"@Feminism Is CANCER *un feminist yeh sahi hai  
but iska matlab ye thodi na hai ki saare women ko gaali de  
agar ek insaan ne rape kiya to uske wajh se hume v rapist sunna parega kya?",0
2847,Arundhati Roy Zindabad,0
1087,"Thore aur sal ruko bhai.. main khud ki movie produce karunga.. Kese meri
chutiya Kat gaya woh dekhaunga aur kese move on hua woh bhi dekhega...
Bollywood se hatke hei ye story....",0
634,Tum jese log hi sexual harassment karte hai ghatiya soch,0
4270,autowala bhaiya тЭд,0
2727,Movie bohot achi h..... Everyone must watch ache content p movie km hi bnti he,0
386,"Ji you are welcome.. agyanta ke pradarshan ka shree ganesha waise aapne kiya
hain. Aur apke bhakta waisebhi achhe se follow kar parahehai. So aapkohi
badhaiyaa!!",0
1097,Aaj se Arundhati ka nam Kung fu kutti ho gaya h,1
2584,Bhai tune dil jeet liyaЁЯШН kya yar jawab diya hai ЁЯШНlove you bhai ssly need thisЁЯШК,0
1755,Dho dala,0
3017,Bilkul sahi bola vai good reviewЁЯШН,0
4495,рд╕рд╣реА рд╣реИредрд░рд╛рд╡рдд рдЬреАред,0
2885,Dill se boss,0
1300,Kaunsi rocket science lagayi hai Bhai? Samjhana Zara?,0
5081,chalo kisi ne to dono taraf se socha,0
2285,"Aapki sonch aapki T-shirt se hi dikh rahi hai kaise Na aapko feminists se
problem ho ....ЁЯСН",0
837,Bhai joker pe review do...,0
3895,Saurabh Ranga - Rajdeep Billa,0
3146,Kabir singh ka logo kya chupane k liye lagaya h ЁЯШВ,0
1105,"Ek gana banana chahiye  
Librandus ke gand me danda",1
2518,Iski South mein ek aur Tamil language mein Remake bann rahi hai,0
5980,bosdk aaunga toh teri gaand fat jayevi,1
1709,"[14:39](https://www.youtube.com/watch?v=N_ZMfQMZos0&t=14m39s) Mai kehta ye
chutiyapanti hai .",0
574,Robin Sahi ye paschim mein chalega,0
1154,neha ji muja lagta h tumhare ghar pe baap bhai nahi h,0
1202,"Ye kya topic h  
Isse jada achhe topic h unpr discuss kro",0
3234,another bangali raand,1
1330,"Bhut achaaaaaaaaa Dil Khush ho gyaaaa ese randi maa baap ko esea he karna
chayee",1
2877,Sir December ka magazine provide Kara dijiye...,0
5823,"film companion mein sanju ka review kaha hai i hope ull understand anupama
chopra spouse of vidhu vinod chopra",0
2267,"Mai janta tha ye bhai bhi hate krta hoga is movie ko meri tarh,mujje pta tha
ji mera point of view kisi k saath match ho na ho is bande k saath jrur hoga",0
4091,"Bhai tu rota Q h bolte huye .....tereko Dekh ke sala sb galat chalara ESe
lagata .....kabhi hasa b kar video m ......sala jaldi na mar jaye tu ...kuch
londo ko Teri jarurat h",0
4828,Gand fat jati hai ЁЯдгЁЯдгЁЯдгЁЯдг,1
1618,"jo log comments me homosexuals ko bura bhala keh rhe hi unhe ye bilkul nhi
krna chahiye kunki ye koi bhi ho Sakta hi Jo Abhi unko bura Bhala keh rehe hi
ho Sakta hi unke bhi Santan homosexuals paida ho . apko bura Laga . Par maybe
Aisa Ho Sakta hi kunki ye creation hm nhi krte ye god krte hi tb aap kya
kahenge . Koi viklang paida ho ya sahi ya homosexual ye unki galti nhi hoti .
Pr unse nich. Bartaw krna aapki galti jroor hoti hi bjaye unko taqleef dene k
hme unko sahanabhooti Deni chahiye. mujhe maloom hi Abhi bhi aap galio se hi
reply krenge pr phr bhi soch badlo aaplog",0
2068,"Plz kolkata new movie
[#bibaho](http://www.youtube.com/results?search_query=%23bibaho)_obhijan
trailer ka reaction do plz sir",0
3435,Bhai dil ki cheezon mein dimag laga raha hai.,0
4444,"ЁЯШВЁЯдгЁЯШВЁЯдг  
Achchi comedy kar lete ho bhai ЁЯСНЁЯСН",0
5787,tu apni muh se tatti krna band kr,0
5563,"kuch larki ke wajah se sari larki jinko iski real me jarurat hai suffer karna
parta hai",0
2638,Liberals aur feminist khali khopdi wale log hai,0
3272,"Is laude ko kis ne review karne diya vai.. ganja khake bolta hai yafir
parallel universe se hai lodu kahika..",1
3150,India mai chutiyap karne se.....bhut payada hy .... Aur e sab uska example hy,0
3451,"Is bhosdi wale ko review krna ghanta nahi aata is ko bolo gaand me apna Lauda
le or chup rahe bhsdika",1
5665,teri naa ki chuuu bhosidiki tu ppagal hai beee,1
6035,"its not a movie review, its a feminist outrage.  
  
didi apki maa ki chut, sorry feminist gaali de di  
ye lo tmhari baap ka lund.",1
126,Behen chod ranu mondol,1
934,Kyun dirty words use karte ho....pls stop it... mujhe distract karta hai,0
3323,Vande mataram,0
3852,"Inke wajah se rone se acha inhe rulao... ЁЯШаЁЯШаЁЯШа aur inko problem kya h?? Agar koi
ladki simple yaa sobar h, to in kamino ko taklif hoti h?? Kyuuu wo bhi to
ladki h ЁЯШаЁЯШаЁЯШаЁЯШа",0
5068,"рдЬрд┐рди рд▓реЛрдЧреЛрдВ рдХреЗ рд╕рд╛рде рд╣реЛрддрд╛ рд╣реИ рдЙрдирдореЗрдВ рдореЗрдВ рдЪрдВрдж рд▓реЛрдЧ рд╣реА рдХреЗрд╕ реЮрд╛рдЗрд▓ рдХрд░ рдкрд╛рддреЗ рд╣реИрдВредрдмрд╛рдХреА рдХреЗ рд╕рд╛рде
рдХреЛрдИ рдиреНрдпрд╛рдп рдирд╣реА рд╣реЛрддрд╛ рдФрд░ рдХреБрдЫ рд▓реЬрдХрд┐рдпрд╛рдВ рдЗрди рдХрд╛рдиреВрдиреЛрдВ рдХрд╛ рдлрд╛рдпрджрд╛ рдЙрдард╛рддреА рд╣реИ рдЗрдирдХрд╛ рджреБрд░реВрдкрдпреЛрдЧ
рдХрд░рддреА рд╣реИред  
рдРрд╕реА рд▓реЬрдХрд┐рдпреЛрдВ рдХреА рд╡рдЬрд╣ рд╕реЗ рдмрд╛рдХреА рд╕рдм рдмрджрдирд╛рдо рд╣реЛрддреЗ рдФрд░ рдмреЗрд╡рдЬрд╣ рдХрд┐рд╕реА рд╢рдЦреНрд╕ рдХреА рдЙрд╕реЗ рдкрд░рд┐рд╡рд╛рд░ рдХреА
рдЬрд┐рдВрджрдЧреА рдмрд░рдмрд╛рдж рд╣реЛ рдЬрд╛рддреА рд╣реИредрдРрд╕реЗ рдЬреВрдареЗ рдХреЗрд╕ рд▓рдЧрд╛рдпреЗ рдЙрдирдХреЛ рднреА рд╕реЫрд╛ рдорд┐рд▓реЗ рдФрд░ рдмрд▓рд╛рддреНрдХрд╛рд░рд┐рдпреЛрдВ рдХреЛ
рддреЛ рдХреЬреА рд╕реЗ рдХреЬреА рд╕рдЬрд╛ рдорд┐рд▓реЗ рдЙрдирдХреЛ рдореГрддреНрдпреБрджрдВрдб рдорд┐рд▓реЗред",1
5552,are bc ye bnane ki kaha jrurt thi. kya prove krna chaate ho..?,0
2060,"U know Mr arnab. Media is 4th Piller of democracy .but you are such a shameful
.  
And the 2nd thing is ,sarkar jab desh ki janta se majak hi kr rhi hai apne is
dusre karykaal me to arundhti roy ├▒e Kya galat kaha.  
Sarkar ko hamne kaam krne ke liye bheja hai ,naaki UPA government ke padchinho
pe chlne ke liye. Jaruri thodi hai ki Congress laaie thi NRC or NPR. To modi
ji bhi laenge.  
Agar apki modi ya prakash javdekar se baat hoti hai to kah do ki kuch kaam
Kare ,logo ko chutiya bnana band kare.nahi to jaise Maharashtra or jharkhand
me gaie hai. Waise 2024 me bhi jaegi.",0
3483,"Ess liberal ka muh pe mutna sahia.  
Fucker Indian liberal",1
1113,ONLY BHARTYE SANSKREET APNAO jo adhami ko jeena ka treeka seekhata,0
947,Londiya pgla gyi h lgta hai..,0
2281,Yeh toh remake hai ek tollywood movie ki,0
197,Bahut hi sahi faisla hai hame hizdo ki fauj nahi chahiye ЁЯШВ,1
2087,chutiya to nhi hu teri tarah pr ru jaroor hoga,0
5230,ek-ek sabd satya hai.,0
1897,"Arundhati roy ki maa ka bhosda bhagao is randi ko 2 takke ke aurat Tukda Tukda
gang ki",1
3405,"рд╕реБрдиреЛ рд░рд╛рдЬрджреАрдк рдмрд╛рдмреВ рдмреЛрд▓рдиреЗ рдХрд╛ рдЕрдзрд┐рдХрд╛рд░ рд╕рдм рдХреЛ рд╣реИ рдЪрд▓реЛ рдорд╛рди рд▓реЗрддреЗ рд╣реИ  
рдордЧрд░ рдпрд╣реА рдЕрдзрд┐рдХрд╛рд░ рд╕реЗ рдЬрдм рдХрд╛рдВрдЧреНрд░реЗрд╕ ,рдЧрд╛рдВрдзреА рдУрд░ рдмрд╛рдордкрдВрдереА рдХреЗ рд▓рд┐рдП рдмреЛрд▓рд╛ рдЬрд╛рддрд╛ рд╣реИ рддрдм рдЖрдкрдХреЛ
рдорд┐рд░реНрдЪреА рдХреНрдпреЛ рд▓рдЧрддреА рд╣реИ",0
3854,рдЕрд░реБрдВрдзрддрд┐ рд░рд╛рдп рдФрд░ рд░рд╛рдЬрджреАрдк рд╕рд░рджреЗрд╕рд╛рдИ рдПрдХ рд╣реА рдЧреИрдВрдЧ рдХреЗ рд╕рджрд╕реНрдп рд╣реИрдВ,0
5395,"i think, dono ke liye chahe voh men ho ya women uske liye india me ek kade
kanoon ki jarurat  
  
tabhi sahi men and women safe feel karenge ЁЯШЗ",0
240,Kitna late hai Tu yr chutiye insaan,0
3375,"Film mazedaar hai...but serious mat lena.... Future dekho.... Ar haan ladkiya
aise nai pat jati dost ....",0
3059,Please KGF movie ka review banao,0
361,Review bana raha hai ya apni mann ki frustration dikha raha hai ye launda? ЁЯШВЁЯШВ,1
3350,A Raj sahi kaha,0
1074,рдирд╣реАрдВ рд╣реЛрдирд╛ рдЪрд╛рд╣рд┐рдП рдЖрд░реНрдореА рд╡рд╛рд▓реЗ рджреВрд╕рд░реЛрдВ рдХреА рдорд╛рд░рддреЗ рд╣реИ рдЦреБрдж рдХреА рдорд░рд╡рд╛рддреЗ рдирд╣реАрдВред,0
2437,aapke hi kahne par mai gaya hu movie..... bahut hi acchi movie hai ye,0
5544,"absolutely ...aaj kal girls apni power ka galat istemal karti hai...pehle
hamre police walon ko or media or local political party kie liye ye hona
chahiye ki wo isko badhawa na de or baad mai iss ke baare mai report darj
karne se pehle 1000 baar puch lein ki kya waki mai kaam hua hai aisa ya
nahi..kyunki kuch begunaho ko saja milti hai galat case ki wajh se ...that's
nice step ...",0
4870,рдмрд╣реБрдд рд╣реА рд╢рд╛рдирджрд╛рд░ рдореВрд╡реА рд╣реИ,0
2316,Kisne touch kiya usko MADARCHOD ЁЯдмЁЯШбЁЯШб,1
5721,nikal lawdy pehli fursat me nikal,1
3167,Pratik borade bjp DallaЁЯдгЁЯдгЁЯдг,1
2058,Allow karna chahiye mere hisab se,0
3305,Kal hi ye movie dekhi...... mast movie hai.....,0
4713,Akshay khanna ki bahot sidhi sadhi hai. Bahot hi acchi hai,0
5003,asaadhaaron vaai,0
2760,Jabardast bhai,0
94,Sai kha,0
3169,Yaar.. Ispe bhoot taras aata hai.. ЁЯШФ itna bitterness.,0
4514,Tatti review,0
1073,BAhut acchi movie hai . section 375,0
5447,"ladkiyan bhi dangerous hy ek rapiest se bhi jada.....jhut bloke ladkon ki life
barbad kardeti hy",1
4977,Are bhai konsi duniya mai rehate hoЁЯШВЁЯШВ,0
1452,"Bhai apki videos dekne ke baad ab meri life me sb set hoo raha hai i m Focus
on my golas...",0
2876,Hamare hindu bhai jo pak jese desho me fase he uski ise koi chinta nahi he.,0
5176,chalo kisi ne tu kuch socha ki hamesa ladka hi galat nhi hota,0
976,╨╜╬╣╨╜╬╣╨╜╬╣ only ╤Х╨╜╤Вee ╥Уr╬╣end╨╜╬╣p ─╕reg╬╣ ЁЯШАЁЯША,0
