ID,Text,Label
1461,"Ye chutia kapil ratta maar ke aaya h isko apna hi raag gaana h ye bhosdi wala
kanhaiya ka kutta lagta h",1
4054,ЁЯШВЁЯШВ unko na kabir singh ke reviw krne k paise nhi diye,0
396,"Auto bale bhaiya is the best ek auto Bala itna broad minded h r Baki k vo mota
khud ko sambhal na pa rha bacha kya smbhalega r Jo khtm krne bale bhaiya h ink
khilaf kro complaint ye aage ya to murder hoge ya corrective rapist's r kuch
ni",0
4968,"Agar maine Kabir Singh pehle dekhi or ooske Baad Arjun Reddy dekhi......fir
mujhe Arjun Reddy kaisi lagegi .....  
Pls reply...",0
5168,ashish nalavade true. apna haath jagannath. ЁЯШК,0
1687,"Kya bat bola yar. Dho dala in sab ko.  
  
Keep it up bro.ЁЯШгЁЯЩПЁЯСНтЬМЁЯСМЁЯСП",0
5719,yeh madarchod hai...joh isme aagayiЁЯШВЁЯШВЁЯдгЁЯдгЁЯЦХЁЯЦХkindly fuck off now,1
2900,Right! Ab bol feminists kaha dur dur tk nhi dekh rhi h,0
5863,"chal nikal fursat mai
l##[#di](http://www.youtube.com/results?search_query=%23di)ЁЯШВЁЯШВЁЯШВЁЯШВ",1
395,Aap aapke review videos ese choti length ke hi banaya karo,0
1509,Sarwat ki kami najar aaya....,0
2969,"AAP SACHMUCH CHUTIYAA HO JO DUSRO KO TO GYAN BAAT TAA HAI .KHUD APNI REAL LIFE
MEI APNI BAATO PE STABLE NAHI REHTAA .BHAAD MEI JAA TU FRAUD",0
950,Rand katwo ki,1
4334,Ekdum aahi kaha sir aapne...тЬМЁЯСНЁЯСНЁЯСНЁЯСНЁЯСНЁЯСНЁЯСНЁЯСНЁЯСНЁЯСНЁЯСНЁЯСНЁЯСНЁЯСН,0
4554,"Koi bnda agr apni seema mai rehne ki koshish karta h ya apne relationship ko
ek maryadit dhang se jeena chahta h to log use gussel over protected jane kya
kya bakwas krte apki baat sunke logo ko apne asli rup mai rehna sikhna chahiye",0
5254,"mene ldko ko ye khty suna h ki ldki ese kpde phnti h kisi ldki ko ajtk jindagi
m ye khty nhi suna ldka ese kpde phnta h ldke log kccha banyan m ajaty h ku
kunki grmi lg rhi n hm phle toh hmare andr grmi bhri h n hm randi h n sbko bdn
dikhana chaty h hmara ye motive thodi h ki kitne comfortable h yrr acche lg
rhe hm toh randi h n isliye phnti h ldke ku unka ky vo ldke h phn skte h tm
phnogi nngi ho jao n sdk pr ghumo nngi hoke jada shok h randi khinki ЁЯЩВ",1
1099,"Ye review nhi tha only discussion tha pls pehle ki tarah review kara karo ye
liberal communist se bore hota hai",0
4209,"sunil ,Rinku,vanshu,preetma,Roshanlal inka itna tukda krunga ....bs ak moka ke
talashhhhh, inka khoon jabtak nhee piyuga tab tak chain sa nhee baithunga, ak
moka bss ak mokaaaa",0
3469,Aapse yah nivedan hai ke aap is chutiya ko kabhi na bhulaye,0
2289,Jai hind ЁЯТЬЁЯТЬЁЯТЬЁЯТУЁЯТУ,0
1640,"Lanat hai un ghattya logo per jo homosexuality jese unnatural aur ghattya kaam
ko support krty hain. Dunya ka koi b religion allow ni krta is ghattya soch
ko.",1
5389,chalo koi to sochta h.. men are also human..,0
3621,"Hii, Shreya aap jinse ye question puch rahe ho na aap unse ye bhi pucho agar
nature ne aapke sath ye kiya hota toh aapko bhi khatm kar dete phir.",0
2452,Jai HIND jai BHARAT.,0
1448,bhakts ke bare me to kuch boloЁЯШВЁЯШВ,0
92,Bakhwas baat hain khas Thor par smaglikta ke to or pe,0
5602,yeh nahi chalegi yar bcse isme masala nahi hai naЁЯШТЁЯЩВ,0
755,Bhai dabaang 3 ke trailer pe toh review banta haiЁЯШВЁЯШВ,0
3372,"Superb sir.....aapne jo bhi bola hain ek mard ki Tarah hi bola
hain.....awesome sir....thank you..  
Main bhi bohat disturbed tha kuch dino se but ye apki relastic bate sun ke
bohat hi positivity mili mujhe...thank you so much",0
3191,"рд╕реМрд░рдн рджреБрдмреЗ рдЖрдк рддреЛ рдмреМрджреНрдзрд┐рдХ рдмрдирдиреЗ рдХреЗ рдЪрдХреНрдХрд░ рдореЗрдВ рдкреВрд░реА рддрд░рд╣ рд╕реЗ рдкрд┐рд▓реНрд▓реЗ рдмрди рдЧрдПред  
рдЖрдкрдХреЛ рдкреБрд▓рд┐рд╕ рдкрд░ рдЧрд┐рд░рддреЗ рд╣реБрдП рдкрддреНрдерд░ рдирд╣реАрдВ рджрд┐рдЦрддреЗред  
рдЖрдкрдХреЛ рдЙрдкрджреНрд░рд╡рд┐рдпреЛрдВ рдХреЗ рдХреГрддреНрдп рдирд╣реАрдВ рджрд┐рдЦрд╛рдИ рджреЗрддрд╛ред  
рдЖрдкрдХреЛ рд╕рд┐рд░реНрдл рдЕрдЪреНрдЫреЗ рдФрд░ рдмреБрд░реЗ рдкреБрд▓рд┐рд╕ рд╡рд╛рд▓реЗ рджрд┐рдЦрддреЗ рд╣реИрдВред",1
5290,"abhi tak rape victims ko help nahi paa raha govt, this kind of bullshit is so
harmful",0
3253,Dogi,0
1589,"Sahi Kiya jab Indian judiciary system hi help nahi karta to men's kya sirf
suffer kare time to take revenge",0
4188,Guruji ЁЯСПЁЯСПЁЯСПЁЯСПЁЯСПЁЯСПЁЯСП,0
285,"Ye Jo video sahi he par shidhe army me joined nahi karna chahi ye inko thoda
niche levels ke liye joining start karna chahiye jese police ya koi or field
me or unke kam ko dekhne ke bad army me joined karne Ka ya nahi karneka sochna
chahiye q ki article 14 se 32 ke bich unko bhi adhikar hee",0
3853,Kal rahul gandi ka tweet k upar apka reaction kya hain,0
4145,@Pratik Borade bharosa acchi baat hai pr andha bharosa nhi .,0
4765,Gyaan mt chod chl,1
625,"Abhi Tak nahi Dekhi
[#kabirsingh](http://www.youtube.com/results?search_query=%23kabirsingh) ЁЯШм",0
2576,SIRF GAYS KO BURA DIKHANA AATA H,0
3601,Bollywood = chutiyapaa,0
1656,"[2:37](https://www.youtube.com/watch?v=ZzsAuDkXq1M&t=2m37s) yar ye society kya
hai Is india se me Bohut hate karta hu Har baath Hamere society tumhari life
society ko kya karna",0
2417,views ka chakkar babu bhaiya,0
4414,"Bhai.....tumhri kuch baatein sahi hain lekin chaku ki nok pe rape krne wale ko
, sharab peeke operation krne wle ko aur apni dadi aur sabko publicly daantana
, sare ladkon ko bolna usse baat nhi krna aur pehle hi baar milne pe road pe
kiss kr lena , yeh kaise justify karoge?",0
1630,Bhai chichure movie ka bhi review kro,0
1876,Mene movie dekhi bahat hi achhi movie hai,0
5573,"bhai kam se kam 50-60 virgin ladki ka rape karo, kam se kam maja to aayega, 5
saal agar jail me rahoge bhi to virgin chut phadne k maja police ka danda ka
dard bhula dega, sala bahut phasa rahi ye log ladke logon ko, law ka misuse
kar rahi hai. sambhal jao ladies kahin law uth gaya hum logon ke protest se to
tum logon ka shikaar hoga sirf, yaad rakho ye govt. mard hi chalata hai,
tumhari koi aukaat nahi hai, chut se nikli ho chut me lawda logi bas ye
tumhara kaam hai. feminism me laude lag jayenge. hum agar aurton ko udne ka
mauka dete hain to uske upar se asmaan bhi hata lene ki taqat rakhte hain.",1
3319,"\---- Ka chakkar  
Or  
Mout ka takker ek hi hai bro",0
1538,Me bhi,0
1484,"Ab left ptrakar log Bipin Rawat ji ke piche pad jaayegi ab ... Ab jabardasti
homosexual ghusane ki koshish karenge.... Gayi ab army bhi gayi...ЁЯШв",0
3230,"Lund lolipop ki tarah chuso to maja atah hai dono goli ko Rasgulla ki tarah
chusu ga darling  
Lund lene ka maja hi alag hai",1
3955,100 % agree bhai buhat chutiyaa movie thi,0
2578,"Tuje itna problem he to q dekha KABIR SINGH,,,n u r saying shahid is
garbage....JUST FUCK OFF FROM HERE",0
4077,"Such kahu to Maine video suni  
Or dekhi bs T-shirt",0
975,рдЖрдкрдиреЗ рдкреВрд░рд╛ рдмреИрдХреНрдЧреНрд░рд╛рдЙрдВрдб рд╣реА рдмрджрд▓ рджреАрдпрд╛ ред рдХреБрдЫ рдирдпрд╛ рдХрд░реЗ,0
1034,Ending chutiyon wali thi movie kii bc,0
5814,tatti critics hai tu likhke lele ЁЯТп,0
5645,"ye hui na baat. ye zaroorat thi aise documentary ki. saala aajkal ladkiyan
unwanted fayda utha rahi hai",0
626,Sachchai kadvi Hoti hai !!,0
4482,Gande fati prhi hai BHAI bacha le,0
1599,"She knows hum sab youtube ke film companion channel pe bhete hai hounds ki
tarah sirf Dream Girl ke liye... isilye humare maze le rahi hai...ЁЯШВЁЯдг",0
5450,feminist ka randi rona hai is desh me,0
4210,bhai ne band bja diya bollywood ka...,0
850,Tera desh bsdk tera apna ghar b hain?ЁЯдгЁЯдг,1
2512,"Sorabh ji... Aapko apna channel chalane ke liye... Rajdeep jaise... Mansikta
waale logo ki aavshakyta kyu h.... Aapko vichar krna chahiye.... Desh ki janta
ne bjp ko 303 seats jita kr bheja h.... Kaise aap kah skte h desh ki janta
sarkar ke against h.... Agar janta against hoti to... Bjp 303 seats nhi jeet
kar aati... Aap desh ki janta ka is tarah se anadhar nhi kr skte... Jo rastr
virodhi h...unko aap itna bada chada kr kyu dikhate h.... Agar aapko lagta
h... Arundati aur rajdeep jaise... Is desh ko achhe se chala skte h to... Nxt
time pm k against election lade...  
Aapse ek anurodh h ki... Sirf desh ke against me hi mat dikhaya kre.... Jo log
desh k saath h... Jo desh ki unnti chahte h... Desh k liye kaam kr rhe h...
Unko bi dikhaye...",0
860,aur laundo kya haal chaal,0
247,Pehle bolna seekh,0
28,"Ye chutiya ladki kon h be ... ... kuch v baak dethi h ......... noob girl ...
ЁЯШВЁЯШВЁЯдгЁЯдг ..",1
5380,modi hai to mumkin hai .....sala,0
5576,"bekar aurate hi jhute rape case kr sakti hai jinka real me hota h vo apne
pariwar aur samaj k darr se case nhi kar paati aur ye aurte shareef aadmiyo ki
life hi khrb kr deti h",1
2044,Hiro ji,0
2250,"Chutiya...hai bo log jo ye nhi jante jo natural hai.....bo natural hi
rahega........ Koe inhe jaker bataye....... Kya frk hota hai.... Ek mard aur
gay me..........lol",0
766,"**рдкрд╣рд▓реЗ рдореВрд╡реА рд░рд┐рд╡реНрдпреВ рдХрд░рдирд╛ рд╕реАрдЦреЛ рдЙрд╕рдХреЗ рдмрд╛рдж рдХрд░реЛред** рдпрд╣ рдореВрд╡реА рд░реЗрдк рдХреА рдзрд╛рд░рд╛ 375 рдХреЗ
рджреБрд░реБрдкрдпреЛрдЧ рдХреЗ рдКрдкрд░ рд╣реИ рдХрд┐ рдорд╣рд┐рд▓рд╛рдПрдВ рдХрд┐рд╕ рдкреНрд░рдХрд╛рд░ рдЗрд╕ рдзрд╛рд░рд╛ рдХрд╛ рджреБрд░реБрдкрдпреЛрдЧ рдХрд░рддреА рд╣реИрдВред рдФрд░ рд╕рдорд╛рдЬ
рдФрд░ рдЕрдВрдзрд╛ рдореАрдбрд┐рдпрд╛ рдХрд┐рд╕ рддрд░рд╣ рд╕реЗ рдПрдХ рдкреБрд░реБрд╖ рдХреЛ рднреА рд╣рдореЗрд╢рд╛ рджреЛрд╖реА рдорд╛рди рд▓реЗрддрд╛ рд╣реИ",0
1228,ye baat bohot sahi kahi bhai,0
6105,tere dislikes dekh behn ki laudi feminists lavdi,1
5185,but ek baar toh jail gaya hoga,0
4192,"homosexual ki 5 se 7 saal tak training dene ke baad unko army me bheja jaye
jisse unke ander puri traha se desh bhakti aye aur woh desh k liye samarpit ho",1
175,"Jo v physically mentally eligible h, deshbhagat h, army lover h, Desh ki seva
karna chaahta h army join karkey, usko jaati, ling k Bina kisi bhedbhaav k
chance milna chaahiye... Thanks",0
516,"Pak army tery zahn PR sawar hogye by. Bhool ja Bhai. Yh apki fouj k gays ki
bat horhy by. Haha",0
3186,"bhout acha explaination diya bhai, mujhe bhi pasand nahi aai movie",0
4921,"Aur movie review mai ye sab kiyu batata hai tu???  
Movie ko explain kar ...movie pe koya aacha laga aur bura laga ye sab bol.. .  
Tu har ek review mai ye sab bolta hai ulta sidha ..  
Wonder woman  
Captain Marvel  
Raazi  
Ab aur ye.",0
2970,"sahi bola bilkul, par yeh bhi h movie m pretti bhi dumbo thi bilkul matlb apna
khud karna h kuch usse ya nahiЁЯШВ jo kare bechara oabir hi kare",0
5235,teri jarurat nahi hain,0
1477,Chutiye tere jaise hee rote ha,0
3542,Bahut sakun Mila ЁЯШВЁЯШВЁЯШВЁЯШВЁЯШВЁЯШВЁЯШВЁЯШВ,0
1442,рдЖрдкрдХрд╛ рд░рд┐рд╡реНрдпреБ рджреЗрдЦ рдХреЗ рд╣рдореЗ рддрдХрд▓реАрдл рд╣реЛ рд░рд╣реА рд╣реИред,0
1370,Bhai kuch bhi bol rha hain ye puri movie chutiyapa hain,0
580,"Bhai web series m sirf gaali aur sex hota h vedio bnaao bade bhai youth ko
smjhao",0
808,"Bhai itne dino ki aag aaj shant hui sale womanizer ghr me ghus ke sez scene
jabrdasti karna sala ye dikhaya movie sale society ki ma bhn kr ri
movie.....sale log fan hai abhi koi inki bhn se sex kre vo bhi inke ghr me
...to in chutiya kabir singh ke fans ki gaan mr jayegi aale hijre kajin
ke...........stud ke name pe sale aurton ki ma bahn karna sikhate hai
bollywood movie me ........nich kahin ke suwar aur is movie ke fan mere lund
pe inki bahno ko bhi aise hi kabir jaisa koi le raha hoga",1
838,Me chahta tha is par ek video,0
2555,"Kuch saal pehle yahi Arundhati roy boli thi ki British se azad hone k baad
India ne kuch nhi kiya sirf aur colonies banayi jaise kashmir, North east
states. Matlb uska logic yeh hai ki North east aur kashmir India ki colonies
hai aur India in sabko azad karke alag country bana de. Isi auraat ne yeh bhi
kaha tha ki Indian Army kashmir main Pakistan army se bhi worst attrocities
kar rhi hai jaise rapes,murders. Baad usne apology manga jab baloch aur
Bangladeshiyon ne bataya ki Pakistani army ne unke saath kya kiya. Yeh ghatiya
aurat hone k saath ek ghatiya aur Opportunistic, selfish Author hai jisko Sirf
apni book ka publicity kar award jeetna ata hai. Acchi English boldena k matlb
yeh nhi ki kisi bhi International platform pe Indian ho ke India k hi against
hi ULTI karo ЁЯЩД.",1
142,"Kya yaar sir apne bohot kharab Kiya  
Spoiler kyu de diya yaaarЁЯШбЁЯШбЁЯШбЁЯШбЁЯШбЁЯШбЁЯШбЁЯШбЁЯШбЁЯШбЁЯШбЁЯШбЁЯШбЁЯШбЁЯШбЁЯШбЁЯШбЁЯШбЁЯШбЁЯШнЁЯШнЁЯШнЁЯШнЁЯШнЁЯШнЁЯШнЁЯШнЁЯШнЁЯШнЁЯШнЁЯШнЁЯШнЁЯШнЁЯШнЁЯШнЁЯШнЁЯШнЁЯШн",0
4261,Chutiya movie hai...,0
5340,"bolna toh bohot kuch chata hun is video ko dekh kr pr kya kahu kuch samjh nhi
aa raha.....thanks aisi documentary bna ne ke liye or please sachchi story hi
suna na lakhon mil jayengi...jail or court main",0
5594,"ye laws un ldkiyo k liye h so such m pidit h or unhe inki bahut jarurat h or
kuch ldkiyan salon k rishte ko rape ka naam dekar ise kamjor kar rahi h",0
2614,"Review sun k lagta hai k itni wahiyaat script waali movie kaisi hogi 1 baar
dekh hi loon??? :D",0
3555,@City of Dreams - Dubai dost mene dekh liya already or aaj firse dekhunga,0
3667,Arnab ne to braber le liya,0
5802,bhak madhaarchod faltiu bakchodi..gand jal gyi feminist madam ki...,1
231,Tu bc hawa ke rukh chla kar chutiye,1
3722,"Liberals View Ke Facts Sunkar ITNA MZA AAYA ki Kapil Sharma Ke show ki zarurat
nhi",0
2170,"Gay to dor ki bat army infantry ma ladkiyo Jo bhi nahi late hame army ma Javan
Chahiye na ki hizde ye Indian army ma nahi chalega",1
5414,"@saamarth yadav bhai reservation hona chahiye lekin economic basis pe na ki
caste based",0
2425,Bhai y Gyan dene ka channal nhi hai... Movie ka review Diya kro,0
5348,"phle baar ye type krne k mauka mila....  
justice for mensЁЯСНЁЯСНЁЯСН",0
5226,"naariwaad ki karo jai  
naariwaad ki karo jai  
yeh kuch bhi kare toh chalta hai",1
5449,itna din ke baad koi humara dukh suna ЁЯЩМЁЯП╗ЁЯШВ,0
1959,is saal ki best h ye. kal hi dekha,0
3433,Bhai kuch b bol rha hai be!!,0
585,"You are the best prteek Bhai.  
Aap bahut se frusteted logo ki awaj ho Jo aaj libral samaj me aawaj nhi utha
skte .libral aurat ko paida hote hi harischandra ka certificate mil jata hai.",1
2822,Ham to last 7min roya film me... Khud ko control hi nahi kar paya....,0
1717,"Aap sirf Hollywood ki hindi me dubbed Hoke aati he wahi movie ya web series ka
raview kiya karo kyo ki india me 80 % log hindi dubbed movie hi dekhte he",0
3886,Ishko movie review karna nhi ata...na to iski koi khud ki soch h,0
274,' Bridge to Terabithia ' movie ko dekha hai ? nahi to dekho..,0
5166,"me wohi to soch rha tha har 20 min me rape kese ?  
(pakistan, peace, india )",0
1679,"Yes actually acha filmmaker woh hai jo audience ko uncomfortable kare...aur
whi iss film mein hua hai...yeh film kabir singh ki life ke upar...usne life
mein jo actions liye unke upar hai...chahe woh sahi ho ya galat ... yeh
journey hai uss character ki...toh kuch bhi galat nhi hai film mein...sbse
important baat yeh hai.. ki aaj bhi hmari society kabir singh jese logo ko
dekhna nhi chahti aur tabhi log film dekhte hue uncomfortable hue... aur yahi
film ki jeet hai...and hats off to sandeep reddy vanga...nd shahid kapoor",0
5877,"ЁЯШВЁЯШВЁЯШВ jali iski jali ... inko
pornh[#b](http://www.youtube.com/results?search_query=%23b) psnd h",1
4179,"Kyu time waste kiya  
Gangs of wasseypur  
Jb tk india m bollywood or cricket hai log chutiya bnge",0
3444,Himanshu saraswat ikr ЁЯдгЁЯдгЁЯдгЁЯдг,0
5578,aur kuch feminist ayegi idhar randi rona karne,0
3743,"Aur yeh v dekho. Taki tum samajh sako k actual problem kya hai movie mein.  
<https://youtu.be/C-lRyevxevA>",0
2980,"Honi chahiye sir bs Bo Apna km shi kre baki koi apne personal life kyq kr hme
kya mtlb itni freedom to honi hi chahiye taki Bo apne sapne pure kr ske chahe
koi bhi field ho..",0
5619,"@priyanshu tiwari ha bhai faltu ma feminist se jod dea ye mamla apas ki ladai
thi",0
103,"@Eminem Vevo typical Indian mindset, jab kuch bolne ko nahi hai toh gaali
galoch, tu zeher khaa le saale dharti ke bhoj anpadh gawar maa baap ki anpadh
gawar low class aulaad !! Bhak loser",0
4074,"To chacha kanhaiya kumar jin logo ko tum log support vo ye nhi bola tha delhi
me bharat tere tukde honge inshallah inshallah  
Liberal sirf dalle h khabgress  
Aur iss pehle tu mujhe bhakt main pehle hi bol deta hun mujhe modi accha nhi
lgta vo modi bhi fake feminism promote kar rha h pr tum logo ka doglepan pr
aur gussa aata h",0
535,Joker karo plz,0
2203,"[6:28](https://www.youtube.com/watch?v=N_ZMfQMZos0&t=6m28s)  
Ohh bhai  
Pagal hai kya  
4 nhi, 2",0
416,Judge ko v lapet lena chahea tha,0
599,Are movie ka review kab krogeЁЯШВЁЯШВЁЯШВ,0
1354,"Jaj to paka hipatitus ka mariz tha wo bhi angrez waaaa...  
Shakl bhikari se bi buri",0
2607,Ladkiyone aasani se rupaye kamane ka tarika dhundha hai,0
1540,But isse declining sex ratio 0 pe chli jygi bc,1
721,"Kasturi shankar want to piece on Christmas Christmas manana he use yaha kyu
bulana desh se use koi matlab nahi hai...cool samjhne wali",0
3638,"Crux of Kabir Singh;  
Ladki ke maa baap ni maanrhe,pregnant kr doЁЯШЖ",1
4825,Is dalle rajdeep ki importance kyo badhata hai lallantop?,1
6106,teri maki ch*d paheli pursat me nikal barna bund fardiya jayega,1
5839,jali na teri gaand bol,0
4371,"Vaaaii mujhe v jhaand movie lagi...Lekin kisiko boltahu to sale dost Ruth jate
h...ye movie sala akela kar diya mereko",0
1600,"Bhai ye movie south me super duper hit hai aur Bollywood me bhi
hui........this shows ki india me kitne % logo ko aapki jaroorat haiЁЯШВ",0
5036,рдорд╣рд┐рд▓рд╛рдУрдВ рдХреЗ рд▓рд┐рдП рдорд╣рд┐рд▓рд╛ рдЖрдпреЛрдЧ рдФрд░ рдкреБрд░реБрд╖реЛрдВ рдХреЗ рд▓рд┐рдП рдХреБрдЫ рдирд╣реАрдВ рдмрд╕ рдврдХреЛрд╕рд▓рд╛,0
2571,akdom aporadh to aporadh hi cahe wo koi vi ho,0
5988,madarchud ...randii saalii...fuck off,1
5789,teri gand mar gya kabir sing .,0
4313,"Bol yeh rahe hai par shabd hamare hai, Matlab dil ki ek ek baat bol di aapne
mere is movie ke baare me and bollywood in general.",0
402,Bhai Ye toxic masculinity apne waha aa gaya? He bhagwan.,0
2178,Sari movies dekhunga.. screenshot le liya hai.ЁЯШН,0
6114,teri ma ki chut randi,1
5872,"meri maaaa ki bosda.... ЁЯдгЁЯдгЁЯдгЁЯдг movie dek rahi thi ya... tere bf ki falshback bol
rahi hai. . . . .",1
112,Kabir s movie 6/10 hai,0
4913,10 out of 10? Pakka dekhunga,0
2236,@Vinay Hotty ?,0
1065,100 me se 95% Rape Females Karti h,0
1108,Kya kar rhe ho bhai,0
1460,Mobarak sir kahaan hain,0
4437,"1 hour ki movie dekhi maine mujhe to bakwas lagi puri illogical lgi i mean ek
surgen jo cigaret pita hai surgery ke bad chappal me baith kar cigret fuk ra
hai banda ladta hai awara hai fir bhi topper hai...wow... totally
illogical...ladki ko kiss kar deta hai first time ladki kuch ni bolti matlab
kuch bhi nhi kya tatti banaya hai movie....baki to itni badi badi thoughts ke
bare me mereko ni pta",0
4329,"Ye Randi ko kon paise deta.hai , jo hindustan ke khilaf baat karti hai",0
5503,"mai fake case me fas chuka hu  
us samay aisa lagta hai  
jaise good man bnne se kya mila  
jiska sath diya  
unhi logo ne try to murder and attempt to rape jaise jhhute cases me fasane ki
koshish ki  
aaj bhi tarikh dekhni pdti hai  
  
jo galti kiya hi nahi uski itni badi saza  
parents bhi mujhe hi galat samjhate hai  
jiska aaj tk mujhe comments milte rahte hai  
ab to sadat si ho gayi.  
jo bhi ho  
jo name tag lg chuka hai  
uski bharpai to shayad is janam me na kr pay.",0
4726,Bhoot gussa rha h is chutie peЁЯШаЁЯШаЁЯШа,0
3972,"Ladke Ladkiyon Ko To Aise Cherte Hai  
Jaise Unki Khud Ki Maa Behan Nahin Hoti....  
Sabko Khush Rehne Ka pura Haq hai  
Pyar Toh Pyar hota hai  
Or fir saccha Pyar chahe jisse ho  
Hamesha sath wahi deta hai...... I'm agree with you",1
125,"Yeh bhaijaan jo bol rha hai sahi hai.. Par ek doubt hai agar koi Bollywood Ka
koi director ya producer isko role offer kiya toh yeh kbhi naa nhi kahegaЁЯдгЁЯдгЁЯдг",0
2217,"Nikal laude pehli fursat pe nikal koi jarurat nahi review Dene ki pehli fursat
pe bhosdike nikal",1
777,"Bollywood movie mein item song mein ladkiyon ko maal bolte he uss tym kuch nai
hota. Hate story 1 mein ladki ka dialogue tha ki mein iss seher ki sabse badi
r**di banna chahti hun uss waqt b koi bc feminists ko dikkat nai thi or yahan
pe unn mc logo ki gaand phatt rhi h",1
1056,"Iska Baal chilwa kar kaleekh poto aur laat maar kar desh se bahar karna
chahiye",0
363,"Katua, communist aur congress  
Se hindu hindustan ko khatra hai",0
4342,"bhai y india h agr ni dikhaya lovestory movie to saale auditions flop kar
denge",0
1820,Hume lgbt aur gay ko aceept karna. Chahiye i thaught that he has human being,0
4520,Nikal pehli phursat me nikal,0
2733,Pagal ho gaye ho kya? Kaun khulle mey sex karna chahega? Mein to kabhi nahin.,0
5062,aitraaz movie yahi consept or baani hai .,0
1303,"Bhaii bhott shii bolaa.. koi to bolta hai shi.. baki sb paise ke piche lge
hai..",0
4430,@kristina wallis bakhwas,0
4085,"Rape capital hai sahi kaha yaha mamle darj hi nahi hote .  
Satyamave jayte pe is par ek full episode bhi bana hai police reform pe  
Ja kar dekhe phir bole .",0
2972,@Ali Khan ЁЯШбЁЯШбЁЯШб,0
324,Hhheee ey kya ho raha hai....ccc,0
2875,"Kya chutiypa batmeez Indian army is Indian army isne bnya h.indian army ko
Indian ne bnya h",0
1286,"Aaj Acha laga galiya bakna shuru kiya wapas  
Thansk",0
4278,"Areyyyyyyy bhaiiiii 10/10???  
ЁЯШ│ЁЯШ│ЁЯШ│ЁЯШ│",0
4497,Joy Kumar ЁЯШВЁЯШВЁЯШВЁЯШВ,0
281,"Jis tarah muth mar baki logo ko bhi apni tarah bna lete hai usi tarah 1000 bhi
homosexual rahe vo pure large number ko apni tarah bna denge.",1
3330,"Yaha kuchh chutiye comment me bol rahe hai ki agar Homosexuals army me aa gye
to war ke time wo G.... Marwane chale jaayenge.... to aise gaandu soch walo ko
yahi bolna chahunga ki USA or France me to Homosexuals allowed hai Army or
defence me, to kya kisi ko doubt hai USA ki Army ki taakat pr..... Besharm log
bol rahe hai ki Army me homosexuals ko laane se Bharat ko Mahaan desh nahi rah
jaayega....Ek inshaan(homosexuals) ke saath Janwar se bhi battar treat krne
wale ye dogle log chale hai Bharat ko ek mahaan desh banaane....",0
3829,Movie theek hi hei.....peisha aa rha hei ...log dekh rhe hei ....,0
1796,"рднреЗрдЪреЛ bollywood рдореЗрдВ рдХрд┐рддрдирд╛ рдкреНрдпрд╛рд░ рджрд┐рдЦрд╛рддреЗ рд╣реИред рдХреМрди рдХрд░рддрд╛ рд╣реИ рдЗрддрдирд╛ рдкреНрдпрд╛рд░ред Creativity
рдХреА рдЧрд╛рдиреНрдб рдорд╛рд░ рджреА рд╣реИ рдЪреВрддрд┐рдпреЛрдВ рдиреЗ рдФрд░ рдЗрдирд╕реЗ рдмрдбрд╝реА рдЪреВрддрд┐рдпрд╛ рддреЛ рд╡реЛ рдкрдмреНрд▓рд┐рдХ рд╣реИ рдЬреЛ рдРрд╕реА
рдлрд┐рд▓реНрдореЛрдВ рдХреЛ 400 рдХрд░реЛрдбрд╝ рдХрдорд╡рд╛ рд░рд╣реА рд╣реИред",0
3837,"Libarals aur Faminist ke liye ab tention nai h kyuki ab aap jese youtuber hi
maar denge in sabki ghatiya soch ko....",1
4208,Ek no review Pratik bhai,0
4079,Kis kis ne ye chutiya movie dekhi hi nhiiЁЯШБЁЯШБЁЯШБ,0
4315,@Dhruv Mehra joker k bad comedians ki image bhi khrab huyi hogi???,0
