ID,Text,Label
519,рдмреЙрд▓реАрд╡реБрдб рдХреА koi рдореВрд╡реА рдмрддрд╛рдУ рдЬреЛ рджреЗрдЦрдиреЗ рд▓рд╛рдпрдХ рд╣реЛ,0
1043,рд▓рд┐рдмрд░рд▓рд╕реН рдХреЛ рдореВрд▓реНрд▓реЛрдВ рдХреА рдирдЬрд░ рд╕реЗ рд╕реНрддреНрд░рд┐рдпреЛрдВрдХреА рдЫрдмреА рдмрд╣реБрдд рд╣реА рдЕрдЪреНрдЫрд┐ рд▓рдЧрддреА рд╣реЛрдЧреА!,0
2590,"@Khushi Panda Khushi Panda Upar ke comments padhe hai mene tumhare....English
ko to RIP kardiya..Jo padh rahe hai unko pata chal raha hai dimag se paidal
kon hai......  
  
""Primarital"" ЁЯШВЁЯШВЁЯШВ",0
1379,Sahi kiya bilkul sahi kiya,0
5435,sahi h,0
5644,"@d m there is nothing related with extra marital affair, we are talking about
fake rape and dowry allegations which indian girls do on their hubby's, kisi k
chehre pe innocent ka tag ni lga hota h , if someone will say ki mera
relationship accha chal rha h mere bf ya husband k sath that doesn't mean ki
aage chalke bi sb kuch will be same kaun kb apna rang badal le future me kuch
thk ni h that's why now we need to beware of women's",0
526,"Jo aatanwadi ke liye sympathy de wo liberal nahi ho sakta na hi hota hai .ye
tumne apne dimaag mein baitha liya hai ki liberals aisa hi karte hain .kis
liberal ki baat kar raha hai name it.",0
1633,Thoda late nhi hogya ? Chordo Apne ko kya ЁЯзЪтАНтЩВя╕П,0
5679,mc apna like dislike ratio to dekh l,1
426,"Ye gaandu pudiabaaz fir a gaya londu review Karne..Abe gaandu ke Lund sauravh
Dwiwedi ki bajah se pal rahe ho we tum ganduo",1
4792,Itne ganwar kaise ho sakte kuch log. Specially jhat Bhai.,0
1537,"all type of movie dubbed in hindi baakiyo ka to pata nahi...lekin aap bataye
aap konse zamane se hain ЁЯШВ",0
571,"Bhagva aur orange me bohut fark hai ЁЯдн,,,, jor jabarjasti ka bjp link, jis
topic me bat ho rha hai wo kro",0
862,"bro sirf shahid kapoor ka violent look aur uska violent character logo ko
pasand aaya tha.... baki story toh bekar hai .",0
4591,Please eski girlfriend kuch na bolo dono Kai rate ek sath gujari hai,1
302,"Movie to Dekhi hi nhi .  
Movie ki ringtone Sahi hai busЁЯШВЁЯШВ  
рд╡реЬрд╛ рд╡реЬрд╛ рд╡реЬрд╛ рд╡реЬрд╛ рд╡реЬрд╛ рд╡реЬрд╛ рд╡реЬрд╛ рд╡реЬрд╛ -рдкрд╛рд╡",0
3814,"Multiple relationship banane wale aj kal k logo k gaal par thappad h ye
movie...  
Four more shot please and veere Di wedding Jaisi chize banane walo ko to bann
kar dena chahiye zindagi bhar ke liye...  
Dhaashu review...",0
4279,Inki maa ki chut,1
5265,"agar rape case pe death penalty hai to fake case pe bhi ldki to death penalty
honi chahiye!!!",0
4982,ko,0
4136,"Loved your review Sir ЁЯШВтЭдя╕ПтЭдя╕ПтЭдя╕П bahut sahi kaha aapne. Kabir singh bahut achi
movie hai fir bhi logon ko hart jagah negativity daalna he hoti hai movie
kabir jo bhi kar raha tha uske peeche reason zaroor tha. Vo movie he puri
kabir singh ke upar bani hai toh jyada focus usi par rahega obviously. I love
the movie too goodтЭдя╕ПтЭдя╕П",0
2097,College mein itne launda hai Kabir Singh waali dp ke saath.,0
606,Fauj h koi tumare bap ka ghr nhi h.bdi aai nhi to gyan dene wali,0
3014,1 no movie h bhai.,0
1892,Arundhati ko thok do,0
434,"Kaun hai ye liberals  
Kaha se aate hai ye log",0
1975,TOMORROW 100% DEKHNA KA HAI BAWA,0
5344,"before- beti bachaao  
  
fir  
beti bach gayi  
  
ab- beta bachaao  
  
  
  
phele decide kr lo kise bachana he",0
1646,Liberanduon ko burnol do ЁЯШЬЁЯШЬЁЯШНЁЯШН,0
688,Arundhati тШая╕ПтШая╕ПтШая╕ПтШая╕ПтШая╕П,0
4194,Yeh movies or tv shows ne hi to barbad kr rkkha hai bc,0
414,@Shubham Bodade aur tu kabir singh dekh karr ganjedi bann ja,0
311,Video dekhte dekhte black out ho gya mujhe,0
4314,Ek number ki gandu movie hai Kabir singh,0
2949,Jabardasti ka feminism ghusoge to kya hoga,0
5829,"ganesh gaitonde to sucharitatyagi. apun kidar tha maloom nai apun ko sirf
gaand marni thi iski.",1
4441,desh bhagat..:D,0
3285,Gays ko nahi allow karna chahiye,0
5554,"best effort against misuse and against fake feminism.
[#mentoo](http://www.youtube.com/results?search_query=%23mentoo)  
ab kuch feminist yaha bhi paan thookne aa jayenge dekhna!!!",0
151,Thode chote video bnaya karo prateek Sir..,0
4226,"Mujhe bhi jand lagi movie lakin maine chutiyo ke samne jaban nahi kholi or na
hi kholuga",0
5842,"iss mardaani aurat ka toh gaand hi maar diya sandeep reddy vanga me interview
meinЁЯШВЁЯШВЁЯШВЁЯдг",1
1319,"Mene Apne ek ristedar k liye suna ye bhosdi ka Kabir singh type ki movieme
gand marake bakchodi kar raha h",1
1027,Aaj Bhai form mein hai ..3 videos in a day..,0
4699,"Abe zand ..... picture k bare me bata..... ar apani soch kisi dusare pe mt
ladane ki koshish mt kr... tere pas akal nahi hai to kisi dusare k pas bhi
nahi hai kya????",0
1706,Sucharita flim companion k bare m h,0
707,jahangir bhai ne to ghazab ka kaam kiya,0
4864,Choot dogi,1
6127,aap bachpan se itni madarchod ho ya fir goo kha kha ke itni madarchod banni ho,1
1696,"Ye Congress har kaam me gandhi ji ka naam leti hai lekin abhi desh me jo hinsa
karwa rahi hai wo bhi Pradhanmantri aur gruhmantri ke clarification ke baad to
ab kahan chale gaye Gandhi ji ke siddhant.",0
1655,Tera dimag tatti ka bna hua hai bc,1
4330,"@Pratik Borade Jyse is video me aap ne jo kaha wo aap ki aapni opinion hy ,
jaruri nahi ki har koi aap se sahmat ho - aysa aap ki hi kahna hy... Wyse hi
ye meri opinion hy... Jaruri nahi ki aap mujhse sahmat ho...  
Soooo Chilll Yaarrr !! ЁЯШЙ",0
2492,"Pic Dekh ke laga shayad kharab review Diya, par baad m pata Chala 10/10",0
5900,"abe chutye college me aa kar koi local bhai teri bandi ko kiss kar le bina
puche aur roz field me ja kar maaze kare usko tu 'preeti samjhti hai kabir ko'
bolega?  
  
shahid kapoor hai isliye sab chalta hai. koi local gunda ho to villain bana
do. samaj me aa raha hai kya point tha? ladka ho k bhi muje dikhta hai. roles
reverse kar le ki koi ladki aa k bina puche kiss kar le and knife dikha kar
bole kapde utar. public seeti maregi kya uspe?",1
5258,"@amit patel han mera bi bf h usne kh ki sex krlo mene nhi kiy usne force nhi
kiy bs bt khhtm ЁЯШБ",0
4257,"Sourav Kumar chutiyee ese kon bolta hai , tu akela hai kya hindu , thora chill
kr",0
2363,"@sanjay amarnani haha i love people like you... Jhat k baal barabar ho ni..
Chale ho andpadh gawar gutter chap krne..... Tm jaiso ki koi ijjat waise hi ni
hai.. Na society mei na ghar mei.... Maa chuda tu phate ballon k natige....",1
3748,Bhai spoiler warning to DE dete ЁЯШб,0
4101,"Tharkiyo k liye kabir singh ek bhagwan jesa hai, mere liye ye mere uljhe hue
jhaat jesa hai aur kuch nahi",0
1859,"Pratik bhai...Pure 16 minute ke video me apne movie ke baare me kuch nahi
bataya...What about screenplay, editing, camera work , acting, music
etc...Phir ye kaisa review hai...Apne apni headline banayi hai...Kabir singh
review ... Thoda to movie ke baare me ek film critics ki tarah batate...Baki
to sab theek hi hai...ЁЯШК",0
5553,"most of the rape cases are false.. it is rightly said in the documentary that
when the two lovers get caught by their families it becomes rape case.. and
how dumb is our constitution that they will arrest any man just on words said
by a women what if he will found not guilty after the imprisonment of months
akd years. how he will remove the blot of rapist how he will survive his next
life indirect form of guilt without being guilty ? what about the precious
time of his career miserably spend behind the lockup and in courts ? and what
about the torture of jail and the money he have to give to judges lawyers
policemen etc. by innocent family memebers ? isse acha to maar hi do bhai
zinda bhi q rakhte ho sidhe death sentence sunao ? rape hua hai ya nahi kisne
kiya hai kisne nahi ye pata lagane me court helpless hai to bhai uski saza ik
admi ko kyu di jaye..?  
shadi baad bhi ajkal ye niyam nikal gaya hai ki admi ko biwi se puchh ke sex
karna hoga to some extent its understanding between the two.. but the irony is
shadi baad bhi biwi rape case kar sakti hai.. what the hell kya niyam bana
rahe ho tum log kya nashe me beth ke banaye kya are wo bhi karo lekin sasta
nasha karke judges ye niyam kyu banaye? ab hmare pas to ik hi rasta hai live
in me raho mast raho ..
[#mentoo](http://www.youtube.com/results?search_query=%23mentoo)",0
3717,Sir unkeliye kuch au restrictions ke sat yo join Kar saktehe,0
3174,"Sir aapko ye kaise or kahan se pata chalta hai ki faminist ya liberals kya
kahte hai ?",0
1930,Love you bhai!! Full kaam chal raha hai!,0
4393,<https://youtu.be/s_lNnD6gKU8> is news ko cover krye,0
2562,"Stereotype mat karo. LGBTQ movement exactly isi cheez ko oppose karti h. Video
mein kitne uncle aunty ne support kiya.",0
5621,"mudda sahi utaya hai bhai.... par movie nahi chalegi...... qki india me log
aisi baato se muh pher lete hain",0
2834,Pyaar hai tu ladke !!!,0
578,Ab hum karenge to tumhe Burma lag jayega,0
2173,Hram khor Tere pas koi sabut h kya Hindu Rep nhi karte kitne ginau,1
4080,Girls gandi hoti hain,0
4341,"awesome review bhai liberals k liye deko at
[11:14](https://www.youtube.com/watch?v=J2J5ssSP5yQ&t=11m14s) ЁЯШАЁЯШВ",0
3318,"Pratik bhi ki bate sonkar fir se arjun reddy dekhne ja raha hu or jo log keh
rahe ki bij ka 1 ghanta boring he arre breakup ke baad woh kis mental stage se
gujar raha he woh dikhana banta tha yaar",0
2453,"@Marrie Sharma are madam Maine bhi toh wo hi kha wo ""not in public means""
public mein nhi karenge jaise pahle private mein karte the waise hi karenge
Lekin ab woh sabke samne apna relationship Ko accept kar pyenge ЁЯЩПЁЯЩП faltu mein
kyu daant rhi hain .",0
4725,"Are intellectual logo , vo bas majak kar rahi thi ...",0
3277,@Rajender ji12ewcgsdffeewandal q apna no.diya kya kam muzse wo to bolo,0
1424,"@Narendra Modi ek baat bol be jhantu is unique kya hai, bhasan Dena koi unique
nahi hota, naa hard work naa koi talent ye sab wese chutiye hote hein Jo sirf
jusroko safayi pelte hein aur tere Jese unki land chat te hein jaa ke apni
mere yahan Matt chudaЁЯЦХЁЯЦХ",1
1625,joker 2019 bhai,0
1958,Kya kare uska pet bharta hai na. Khane do.,0
1983,"didi ko PINK movie ka justification bhi dena hai....section 375 ko created by
bunch of men bhi keh di.....aisa kaise chalega didi",0
4990,jio boss darun ........,0
5659,chutiya hypocrite...,0
4644,@Pratik Borade Jai ram ji ki.,0
2687,kitane log kabir Singh movie ko av Tak nahi dekha meri tarah,0
4032,"ISKIH BIRUDH PURI TARAH SE KARBAI HONI CHAHIYA. AUR KI DESH KIH BIRUDG
CHAKRANTA KARNE KE LIYA ISKOH ARREST KARNA CHAHIYA AUR IN JAYSE PAGAL KUTTIO
KOH JAIL MAIN DAL DENA CHAHIYA HAMESHA HAMESHA KEH LIYA. JAI HIND BANDEMATARAM
ЁЯЗоЁЯЗ│ЁЯЩПЁЯЗоЁЯЗ│ЁЯЩПЁЯЗоЁЯЗ│ЁЯЩПЁЯЗоЁЯЗ│ЁЯЩП",1
5403,wow what a topic . hamesha ladki sahi nhi hoti .,0
1560,are yr gyan mat baato review kro,0
1180,рд░рдВрдЧрд╛ рдмрд┐рд▓рд╛ рдореБрдЬрд░рд┐рдо рдереЗ рдЬрд┐рдиреНрд╣реЛрдВрдиреЗ рдорд╛рд╕реВрдо рдмрдЪреНрдЪреЛрдВ рдХреА рдЬрд╛рди рд▓рд┐ рдереА ред рдмрд╣реБрдд рджрджрдирд╛рдХ рджрд┐рди рдерд╛ рд╡рд╣,0
427,"[8:07](https://www.youtube.com/watch?v=N_ZMfQMZos0&t=8m07s) ladki aayi ladka
ko pyar ho jata hai...  
Kaise pyar ho jata h bhai?  
Phir vahi bollywood ka purana formula..  
Ladke ne ladki ko dekh liya ЁЯШЕЁЯШЕ  
Khatam baat pyar ho gaya itna ho gaya ki av vo mar jayega uske liye ЁЯШЕЁЯШЕЁЯШЕ",0
4900,"Haramjadi paidaishi saitan sujana hindu naam ka aard leke jihadiyat failati
hai. Coward urban naxialistЁЯСа",1
1169,kya baat h dada ЁЯШОgjbЁЯСМЁЯП╗,0
5287,kitna ladko ki life ki maa chod gayi hai,1
4702,Bhosdiwalo bina spoiler k review Diya Karo...,1
496,"Kaun hai woh mother Chod ladki. Mujhe koi link do. Aisi Gaali dunga ki pura
din kharab hoga",1
2721,Teri maa ka bhosda,1
5053,"yes exactly aisa karne se sach me jinko jrurat hoti hai help ki onko b log
shak ki nazar se dekhte hai..beaing a mother,sister, daughter wife i never
suport these type of female......",0
3224,"Bollywood ki best movie ise aap keh sakte hai.  
  
One line for  
Agar ladki ne apke sath sex kiya hai apni marji se or wo bahar jake bole apne
uske sath rape kiya than start section 375.  
Karoge to bhi maroge nahi kiya tab bhi marenge.",0
488,"Us ladki ne Kabir Ko khud ghar pe Bulaya tha... Film thik se nahi dekhi kya ??
Ya samajh me hi nahi aayi film ??",0
2083,@vaibhav tare bhag madarchod,1
3309,"рдЖрдЬ рд╕реЗ рддреБрдо рджреЛрдиреЛрдВ рдХреЛ рдирд╣реАрдВ рджреЗрдЦреВрдВрдЧрд╛тАвтАвтАв  
рд╢реЗрдордлреВрд▓ ред  
рд╣рд┐рдиреНрджреВ рдзрд░реНрдо рдХреЗ рд▓рд┐рдП рднрд╛рд░рддрд╡рд░реНрд╖ рдХреЗ рдЕрд▓рд╛рд╡рд╛ рдХрд╣реАрдВ рдФрд░ рд╕реНрдерд╛рди рдирд╣реАрдВ рд╣реИ ред",0
2234,"Kuch logo ko Om Shanti Om pasand hai to kuch ko Taxi Driver, pr muje is se
ghnta frk ni pdta",0
1702,Bhai aadha shave kiya tha ?,0
4794,Diljit dosanjh ki Pu njabi movie shada ka review kro pls,0
3385,"ЁЯдгЁЯдгЁЯдг ржирж╛ржирзБ ржжрж┐ржжрж┐
$ржЙрж▓ржЯрж┐ ржЧрзБржирждрж┐ рж╕рзНржЯрж╛рж░рзНржЯ ржХрж╛рж░ржжрж┐ ржпрзЗ,,,,,
ЁЯЗзЁЯЗй",0
3571,"Lok tantra, Hindustan ke constitution par poora vishwaas hai par iss facist
hitler government par 0.0% vishwaas nahin hai",0
1429,"Louda...Aaa...bhikirin...khali Aaa...uskay Aagay kuch hay ki Nahin...Rly wali
khoj raheeay..",0
4241,"""Jab tak bollywood h log chutiye bante rahenge""",0
5192,"asi ladkina kahi na kahi hmari hi kisi kamjori ka fayda uthati hai... be
honest be pure and be safe",1
669,"[#Lowde](http://www.youtube.com/results?search_query=%23Lowde) Teri koi self-
respect nai hai kya ?  
[#Lund](http://www.youtube.com/results?search_query=%23Lund) jaisi Shakal
lekar kabhii bhi achhi se achhi Movie ka Postmartam karne aa Jaata hai..  
[#Bc](http://www.youtube.com/results?search_query=%23Bc)",1
1071,Apne toh feminist ki ijjat utar diЁЯдгЁЯдг,0
1304,"@Harshit Rawat Abb bhi maine kam sutra ni padhi hai .  
Aur gar tune padhi hai to tu marva fir .",1
4931,"Kaun hai ye librandu, salo ka naam batao....ak ak k leta hu",1
2611,"First 3 minutes I have watched your videos. Mene or logo Ka vi review is movie
ke dekhe hai. Lekin tumhara Tara review se hatkar Kisi ne nehi batai.",0
2489,"Bhai aaj full form m h  
Ik hi din m 3-3 video ЁЯФеЁЯШО",0
5452,bhai shi bola,0
575,"Kshitij Walwaikar are yrr ye bhed chal Valle log hai khud toh opinionated hote
nahi jo log karte hai vahi akh aur dimag band kar k copy karte hai isne logic
puchne ka koi faeda nahi ЁЯШВЁЯШВЁЯШВ",0
3578,@kapil bisht GayHind ЁЯШАЁЯШВ ЁЯШВ,0
1287,"I think ye section ko banned krna chahye ye sb jo smjhte hain k is sec ko pass
hona chahye tha wo sico hain qk inho ne gandi videos dekh dekh kr aona ye haal
kr liya hai sooo sicho people apna ilaaj krwao na k ye gandi hrktein kro",0
3320,"Arre iss pagal mental hospital se bhagi hui aurat ko pakad ke jail mei daalo
naa.. issko pakad te kyu nahi.. yeh aise kaise bharat mei aa ke aise bakwas
karti hai.. Ek 3rd class writer, bad dimag, bud mizaj, awaal darje ki
sarphiri.. Arundhati pagal aurat, ek number ki haramkhor aurat.",1
39,The darknight ka review kariye please,0
1095,Sabse pehle to aise log army me jana he nahi chahengay.,0
2768,"**Kabir Singh** time hi nahi tha essi picture Dekh ne ka... **Kab aayii kab
gayiiЁЯШБ pata hi nahi chalaЁЯШВЁЯШВ**  
 **Seriously apun nee nahi dekhaa**",0
445,O stri friendship karogi???,0
1689,Aap pehle se mote ho gaye ho,0
3178,"Sanju movie mai jo ranbir ne sonam ke gale mai wo toilet seat daal dia tha
..tab koi kuch nahi bolla sab kabir singh ke pocke kyu pade hai ......sab
jalte hai shahid se pata sabko agar shahid form mai aa gya na to ranbir ranvir
ki dukaan band ho jayegi..",0
5711,yeee kyyy chutiya bandi hai bee httЁЯЩД,0
5537,"i was raped kehna aasan nahi hota [sir.as](http://sir.as/) u said in video.
par ye saach hai kuch iska phayda uttha rahe hai to hi aaj aap ye keh paye
hai. real victim always suffer male or female no matter",0
3978,"Sir mera opinion h ki agr wo army m aana chaahte hn toh aa skte hn...  
Or jbb baaki log desh sewa kr rhe hn toh inhe bhi haq h apne desh ki sewa krne
ka...  
Or sir ye bhi toh insan hn inhe bhi pura haq h khul kar jeene ka or apna
manchaaha kaam krne ka...  
Jaisa ki normal logo ko haq h apni mrzi ke hisab se kaam krne ka...",0
5959,"sala jo jo banda yaha pe ganda comment dala h ... sabki maa ****** h...
samjha... chutiya h tumlog sab.. haat",1
2917,Bhosidiwale tu film review de na politics kyun samjha raha hai gandu,1
319,"In feminist ke reviews Ko dekh kar sochta hu Thanos ne kuch galat nai Kiya tha
adhe logo Ko dust karke sare nai Lekin kuch to Kam hue the",0
5022,"@arunakaushalya ranasingha  
me too",0
265,"Bilkul ni dena chyea..  
Gay ko to desh se nikal dena chyea.. ho sake to jaan maar do .. ЁЯШСЁЯШС",1
6068,bc veere di wedding ke time teri konsi maa chudi thi.bkl,1
2883,"Bhai honestly aja jara apka video achcha lagrah hai nachrul lights se app bhi
achche dik rahe ho",0
5338,"bhai jisne banai hai use 1000 baar pranam. this is the thing we need for the
people who says ki mard hi hamesha galat hote hai nhi bhaisahab samne wale ki
intension bhi galat ho skti hai aur in rape laws ka bahut fayda uthaya gaya
hai 2012 ke baad . isme laws toh bana diye but inme badlaav nhi kiye gaye yeh
sabse badi galti ki aur isi ka bhugtaan bekasur mardo ne bhi kiya. beghuna bhi
saabit hue mgr jo saja aur rapist ka tag jo mila uska kya ??? insaaf de skta
hai kya kanoon aise beghuna ko...!!",0
5008,@priyanka halder talegong 41 wayad..,0
1670,@Jigar Kumar to do nbr,0
2075,"@Jayanta Sarkar ЁЯШВЁЯШВЁЯШВЁЯШВ Maine bhi dekha woh video, Gazab video hai, poora faad
saala uss laundiya ko.",1
4834,"Jo log sochte h Hollywood me bhi aisi movie bnti h to Hollywood me aise logo
ko hero nhi antihero ya villain bola jata h ye chutiyapa india me hi famous h",0
1137,"Apney pay self reliant is the definition of mard, perfect!ЁЯСН",0
1814,"Hello Patrik sir  
RAMBO movie ke all part hindi me he kya ?  
& all part kisi ek platform me available he  
Plz rply",0
225,FAMINIST AUR LIBRALS KI AMMA KA BHOXDA,1
4347,рдЕрдЪреНрдЫреА рд▓рдЧреА рд╡реАрдбрд┐рдпреЛ,0
4889,Chal.....,0
5702,"dekh tu mandarchod toh thi...hi pr ab behen ki loudi ban chuki hai.  
woh movie apne aap main ek kahani hai...or tu kyu apna bhosda foola rahi
hai...  
ek baat bolu yahi ladkiya hoti hai jo feminism ke name pe gala faadti hai or
naya bf milte hi chut...or tum bataogi hume ki movie kaisi hai...lakshay bhai
ka video dekha toh socha buddhhi ki thodi taarif kar ke aata hoon. toh aaya
tha ab chalta hoon. tum tumhari maa chudao lakshay bhai tumhare sath hai...",1
347,"@ak 98 ab in Feminists logo ki koi nahi sunraha......ЁЯШВЁЯШВЁЯШВЁЯШВ.... ab bas ye bhokti
rahengi ......ЁЯШВЁЯШВЁЯШВЁЯШВЁЯШВ",0
2813,"Sir pichle 1 months se Koi video nhi aa rahi thi  
Ab kai din se continue  
Thanksss",0
4037,"This channel is going in another direction  
Pehle maza ata tha review dekhne pe  
Ab film ki baat chor ke kuch aur hi baat chalti hai",0
2420,"Ghanta intellectual, dumb hai bhudiya.",1
4946,"Sir, kabir Singh to south movie ki copy hai <https://youtu.be/aozErj9NqeE>",0
4247,"kya? kisko kisse compare kar rhe hu  
compare same level mein kya jata h",0
3101,Bhai review kaha tha,0
4674,"рднрд╛рдИ рдПрдХ рдмрд╛рдд рд╕рдордЭреЛ рдПрдХ рдореЗрд▓ рдЧреЗ рдЖрд░реНрдореА рдЬреНрд╡рд╛рдЗрди рдХрд░рддрд╛ рд╣реИ , рддреЛ рдЙрд╕рдХреЗ рд▓рд┐рдП рдЕрдиреНрдп рд╕рднреА рдореЗрд▓ рдПрдХ
рд▓рдбрд╝рдХреА рдХреА рддрд░рд╣ рд╣реИ , рдЕрдм рдЦреБрдж рд╕реЛрдЪреЛ рдЬрдм рдПрдХ рд▓рдбрд╝рдХрд╛ рдФрд░ рд▓рдбрд╝рдХреА рдПрдХ рд╕рд╛рде рдХрд╣реАрдВ рд╕рд╛рд▓реЛ рддрдХ рдбреНрдпреВрдЯреА
рдкрд░ рдХрд╛рдо рдХрд░ рд░рд╣реЗ рд╣реИ рдЙрдиреНрд╣реЗрдВ рд╕реЗрдХреНрд╕ рдХрд░рдиреЗ рдХреЛ рдирд╣реАрдВ рд╕рд╛рд▓ рднрд░ рд╕реЗ рддреЛ рд╡рд╣ рдХреНрдпрд╛ рдХрд░реЗрдЧреЗ ред рдЕрдЧрд░ рдпрд╣
рд╕рдм рдЖрд░реНрдореА рдореЗрдВ рд╣реЛрдиреЗ рд▓рдЧрд╛ рддреЛ рддреЛ рд╣реЛ рдЧрдИ рдбреНрдпреВрдЯреА ,  
рдФрд░ рдЬреЛ рд▓реЛрдЧ рдпрд╣ рдХрд╣ рд░рд╣реЗ рд╣реИ рдХрд┐ рд╣рдо рд▓реЛрдЧ реирез рд╡реАрдВ рд╕реЗрдВрдЪреБрд░реА рдореЗрдВ рд╣реИ .... рдЕрдореЗрд░рд┐рдХрд╛ рдЬреИрд╕реЗ
рдбреЗрд╡рд▓рдкреНрдб рджреЗрд╢ рдореЗрдВ рд░реЗрдк рд╣реЛ рд╕рдХрддреЗ рддреЛ рдлрд┐рд░ рдХрд╣рд╛ рдирд╣реАрдВ рд╣реЛ рд╕рдХрддреЗ рдЙрдирд╕реЗ рдЬреНрдпрд╛рджрд╛ рддреЛ рдХреЛрдИ рдУрдкрди
рдорд╛рдЗрдВрдб рдирд╣реАрдВ рд╣реЛрдЧрд╛  
рджреБрдирд┐рдпрд╛ рддрд╛рдХрдд рдмрд░ рдХреЗ рдХрд╝рджрдореЛрдВ рдореЗрдВ рдЭреБрдХрддреА рд╣реИ рдпрд╣ рд╣рдореЗрд╢рд╛ рдпрд╛рдж рд░рдЦреЛ , рдЪрд╛рд╣реЗ рдЖрдк рдХрд┐рддрдирд╛ рднреА
women and powerment ki bat krlo Jo reality hai bh hai  
рднрд▓реЗ рдЪрд╛рд╣реЗ рдЖрдк рдЙрд╕реЗ accept na kre bo alg bat hai ЁЯШВЁЯШВЁЯШВЁЯШВЁЯШВЁЯШВЁЯШВЁЯШВ",1
2548,Pratik tuje koi movie pasand ati ki nahi...,0
3925,Kung thoo gadhaia hai,0
3919,Gadar,0
812,Purv kutta wala,0
797,Allah hidayat dy amen,0
6044,behen ke lauri kya re there chuth mein,1
2863,"Bollywood se call aaya toh btana bhai pura community movie dekna hi bnd kr
dega..bs aise kadwa sach bolte rhna bhai ji jiski bht jrurt h yuva logo ko..",0
