ID,Text,Label
1014,bsdk k 4-4 ad daal rha deta h betichod,1
5779,"inn madam ko kabhi pyar kya hota h ye nahi pata chal payega, bechari feminism
ke chakkar mai aise hi marr jaayegi.",0
2932,Kya ukhad liya tune ise dekhkar??,0
1708,"Maine apne ghar pe ek chaukidaar rakha, ab wo chaukidaar kahta hai tum sabit
karo ki tum hi is ghar ke malik ho.",0
1871,**Jab Bhagwan Ko apni marji hi chalani hai to hame paida hi kyu Kiya**,0
6122,vag behen chod,1
723,"рдХреБрдЫ рдХрд╛рдо рджрдВрджрд╛ рдХрд░рддрд╛ рд╣реИ рдпрд╛ рдЦрд╛рд▓рд┐ рдлрд╛рд▓реНрддреБ рдХреЗ рд╡реАрдбрд┐рдпреКрдЬ рдмрдирд╛рддреЗ рдмреИрдЯрд╛ рд╣реЖ! рддреБ рдТрд░ рддреЗрд░реЗ
рд╡реАрдбрд┐рдпреЛ ! рддреБрдкреБрдХ !!!!",0
2926,Bhai tu sudhrega nahi ЁЯШВЁЯдгЁЯШВЁЯдг,0
2426,"Bas ak moka ke talassh, ma be apna susral walo ka khoon peena chahta hoo, bas
ak moka milna chahya to fir ma ne 7 lasha bicha doonga, hindustan ka kanoon ki
Maa kee choot",1
4159,Bhai plzzzz Nani starrer gang leader ka review kijiye,0
1164,Ek word chl be chup ЁЯШИ,0
5749,"haa ye movie se jhaal lggya or what about veere di weeding ? pants me baraf
daala to ye tharki or usme jo masterbation or sab chutyapa bhara pada h woh
sahi waah re betichod ? bohot bhayank dogli ho yr tumlog or jhaat hindi nei
aati kya tumlog ko haa lawda rhti yaha p ho but bhasa english hona chaye ekdum
......behen bahar hi citizenship lelo badi feminist banti ho tumlog ha jhat
yhi sab chakkar mai toh aaj desh piche h lawda kaam dhanda kro or karne do
logg ko faaltu chiz logo me promote na kro .... hr waqt lawda ek hi baat k men
women are equal women can do anything that men can do abe jhaat itna hi
equality chahye na toh jao border m jaakr guns lekr khadi hojao fir dekhta hun
equality kaha dhukta h ?abe hum maante h women are equal to men  
but not in everything har kisi ka apna jgah h apna mukaam h or hum isme maante
h pr shayad tum jhaatu log is baat ko nei maanti ho or shayad tumhe shak v h k
women and men are equal isliye toh itna is mudde p bhawkti ho hum nei baat
krte ispr kyu ki hum jaante h that they are equal",1
3766,"oh gaandu , ye movie hit hui kuki log relate kr gaye the isko...tu logo ko
thik kr bs...!! movie ki gaand maarne ki jrurt nhi hai , haa wo point thik hai
ki move on kr lena chahiye...!!! baaki sb log kr rhe hain phle se be...!! jo
hota hai uspe movie hai...!!!",1
4229,"Katai kakashi jaisa ho gaya tha kabir  
(Rin ki death ke baad)",0
5071,"thank u for making this...  
  
  
mera ek sawal hai ek couple relationship mai dono ne agree hoke sex kra dono
ne wo personal space n time enjoy kiya...  
  
and future mai kisi waje se shadi nhi ho pa rahi na ladka chayta h ki shadi na
ho na ladki par aysa ho raha h, so to is baat pe ek ladki kyse ye khe sakti h
k he rape pe.  
  
sex to dono ne kiya na dono ne apni marzi se kiya fir ladka gunhegaar
kyu.?????",0
4117,Kiya bat hai,0
3380,Feminists ro rahe haiЁЯШВЁЯдгЁЯШВЁЯдг,0
1935,Maa chuda feminism ka,1
3603,"Sahoo jse bakwaas movie 100 crore kma ta hai or Article 370 jse accha movie
hamesha kam kyu kma ta hai...",0
2703,"Abbey to yeh wala point aaj ke movie se related hai issi liye to dikhaya hai
Lekin AAP BC mc likne mein bahut busy Rahi hongi shayad iss liye miss kar
diya..",0
190,Bhai mane to Kal hi Dekhi ha ye,0
2938,"Sir [real.love](http://real.love/) nhi smjynge ....y log ..film ..film
to.dhansu h .esa man to.ajkl.nhi h",0
1972,"movie bohot acchi hai mgr true luv ??ye kaisa true luv hai jisme hero itni
sari ldkiyo ke sath relation bnata hai ye mujhe true luv nhi lga commited toh
tha wo bt imandaar??imandari ka mtlb bohot sari ldkiyo k sath rlation bnana
hota hai kya?apne bhartiya culure ki baat ki ye bhariya culture h kya?ati wadi
kisi chiz ki acchi nhi hoti na nariadi na purush wadi or hero k multiple
pysicl relation ko sahi bolkr aap ati pushwad nhi kr rahe kya?baki movie acchi
h music bhi accha hai",0
2392,Kyon thak raha hai bhai,0
4067,"рд╣рд┐рдиреНрджреБрдУ рдХреЗ рд▓рд┐рдП рдЕрддреНрдпрдиреНрдд рдЬрд░реВрд░реА рд╕реВрдЪрдирд╛ --  
рдЬрдм рдЖрдк ola рдпрд╛ uber рдмреБрдХ рдХрд░реЗрдВ рддреЛ рдореБрд╕реНрд▓рд┐рдо driver рд╣реЛрдиреЗ рдкрд░ booking рдХреЛ рдХреИрдВрд╕рд┐рд▓ рдЬрд░реВрд░ рдХрд░
рджреЗрдВ, рдЖрдЬрдХрд▓ рдореБрд╕рд▓рдорд╛рдиреЛрдВ рдиреЗ рдЯреИрдХреНрд╕реА рдЬрд┐рд╣рд╛рдж рд╢реБрд░реВ рдХрд░ рджрд┐рдпрд╛ рд╣реИ, рдпреЗ рдЕрдкрдиреА рд╣реА рд╣рд┐рдиреНрджреВ рд╕рд╡рд╛рд░реА
рдХрд╛ рдХрддреНрд▓ рдХрд░ рджреЗрддреЗ рд╣реИрдВ рдФрд░ рдЙрдирдХрд╛ рд╕рд╛рдорд╛рди рд▓реВрдЯ рд▓реЗрддреЗ рд╣реИрдВред рдпреЗ рд╣рд┐рдиреНрджреБрдУрдВ рдХреЛ рдЦрддреНрдо рдХрд░рдиреЗ рдХрд╛ рдПрдХ
рдирдпрд╛ рд╣рдердХрдгреНрдбрд╛ рдЕрдкрдирд╛рдпрд╛ рдЬрд╛ рд░рд╣рд╛ рд╣реИред  
рдЗрд╕ рдЯреИрдХреНрд╕реА рдЬрд┐рд╣рд╛рдж рдХрд╛ рдПрдХ рдЫреЛрдЯрд╛ рд╕рд╛ рдЙрджрд╛рд╣рд░рдг рд╣реИ - рдореЗрд░рда рдХрд╛ рдЯреИрдХреНрд╕реА рдбреНрд░рд╛рдЗрд╡рд░ рд╕рд▓реАрдо, рдЬреЛ 120
рджрд┐рди рдореЗрдВ 250 рд╣рд┐рдиреНрджреБрдУрдВ рдХрд╛ рдХрддреНрд▓ рдХрд░ рдЪреБрдХрд╛ рдерд╛ред  
рдЗрд╕рд▓рд┐рдП рдЬрдм рднреА рдЖрдк рдХрд┐рд╕реА рдСрдЯреЛ, рд░рд┐рдХреНрд╢рд╛, рдЯреИрдХреНрд╕реА рдЖрджрд┐ рдореЗрдВ рдмреИрдареЗрдВ рддреЛ рдЙрд╕ рд╡рд╛рд╣рди рдкрд░ рджреЗрд╡реА
рджреЗрд╡рддрд╛рдУрдВ рдХреА рддрд╕реНрд╡реАрд░ рдЬрд░реВрд░ рджреЗрдЦреЗрдВ, рдЕрдЧрд░ рддрд╕реНрд╡реАрд░ рдирд╣реАрдВ рд╣реИ рддреЛ рдЙрд╕ рдЧрд╛реЬреА рдореЗрдВ рдмрд┐рд▓реНрдХреБрд▓ рди
рдмреИрдареЗрдВредрдорддрд▓рдм рдпрд╣ рд╣реИ рдХрд┐ рдХрд┐рд╕реА рднреА рдореБрд╕реНрд▓рд┐рдо рдбреНрд░рд╛рдЗрд╡рд░ рдХреА рдЧрд╛реЬреА рдореЗрдВ рдЖрдк рднреВрд▓рдХрд░ рднреА рди рдмреИрдареЗрдВред
рдпрд╣ рдореИрд╕реЗрдЬ рд╕рд┐рд░реНрдл рдкреЭрдХрд░ рдордиреЛрд░рдВрдЬрди рдХрд░рдиреЗ рдХреЗ рд▓рд┐рдП рдирд╣реАрдВ рд╣реИ, рдордиреЛрд░рдВрдЬрди рдХрд░рдиреЗ рд╡рд╛рд▓реЗ 100
рд╣рд┐рдиреНрджреБрдУрдВ рдХреА рдЬрдЧрд╣ рдЗрд╕ рдореИрд╕реЗрдЬ рдХреЛ 10 рдЧрдореНрднреАрд░ рд╣рд┐рдиреНрджреВ рдкреЭреЗрдВ рдФрд░ рдЕрдорд▓ рдХрд░реЗрдВ рддреЛ рдЬреНрдпрд╛рджрд╛ рдЦреБрд╢реА
рд╣реЛрдЧреАред  
рдФрд░ рдЬрд┐рди рд╣рд┐рдиреНрджреБрдУ рдХреЛ рдЕрдкрдиреЗ рдмрдЪреНрдЪреЛрдВ рдХреЗ рднрд╡рд┐рд╖реНрдп рдХреА рдЪрд┐рдиреНрддрд╛ рд╣реИ, рд╡реЛ youtube рдкрд░ narsingh
vani, satya sanatan, hindu publisher, рдЪреИрдирд▓ рдЬрд░реВрд░ рджреЗрдЦреЗрдВред рдпреЗ рдЖрдпреЗ рджрд┐рди рд╣реЛрдиреЗ рд╡рд╛рд▓реА
рд╣рд┐рдиреНрджреВ рд╣рддреНрдпрд╛рдУрдВ рдХрд╛ рдЦреБрд▓рд╛рд╕рд╛ рдХрд░рддреЗ рд╣реИрдВ рдФрд░ рдПрдХ рдПрдХ рдЕрддреНрдпрд╛рдЪрд╛рд░ рдХреЛ рджрд┐рдЦрд╛рддреЗ рд╣реИрдВ, рдЬрдмрдХрд┐ рдореАрдбрд┐рдпрд╛
рд╣рд┐рдиреНрджреБрдУ рдХреА рд╣рддреНрдпрд╛, рдмрд▓рд╛рддреНрдХрд╛рд░ рдкрд░ рдЪреБрдк рд░рд╣рддреА рд╣реИ",0
1635,Sahi pratik bhai apne bola kabhi acchi movie se in logo ko problem ati hai,0
458,"nice yar sala ladka samaj ta ha ki ladkiya unka bina kuc nahi asal bat to ye
ha ki ladko ki okad ladki ka bina kuc nhi",1
3768,Thik kaha hai army Chief ne,0
3914,Ye Rajdeep khud ek chuteya aadmi hai communist,1
1953,"Thanos ka half universe wipe out karna ka sabse bada reason sayed ye
""feminist"" aur ""liberals"" hai ЁЯдгЁЯдгЁЯдгЁЯдг",0
1346,Bhai ek group bano hum bhi leftist ko jawab dena chaate hain,0
4610,"Accha hai anime india mein anime nahi hai warna yah fake feminist anime ko bhi
barbaad kar denge",0
4656,"@Ahmad Baloch shi hai kuch gays army mein honge to tere jaise army base mein
pkde gye to unse gand mrwa denge",1
2085,"рдРрд╕реЗ рдФрд░ 10 ... 12 рдХреЗрд╕реАрд╕ рд╣реЛрдиреЗ рдЪрд╛рд╣реА рдпреЗ рддрдм рдпреЗ 498 ...dv act 2005 рдХрд┐рддрдирд╛ рдЪреБрддреАрдпрд╛рдкреНрдкрд╛
рд╣реИ рдпреЗ рд╕рдмрдХреЛ рд╕рдордЭ рдЖрдпреЗрдЧрд╛",0
5526,"mene bi juthe rape case mai 7 mahine ki jail kati hai 40 lakh dene pde tab
jake m nikl paya us se  
puri life change ho gyi aj tk wo hadsa bhul nahi pata..... kon jimedar hai pta
nahi",0
119,Khatam Matlab khatam ЁЯШЖЁЯШЖЁЯШЖ uncle ko khatam hona mangta h apun,0
4808,"Atlast ye kiya ja skta hai ki non combatant trade me allow kiya ja sakta
hai...  
Agree or Not..????",0
5942,feminist or feminazi ki maa chud gai hai iss movie se??????,1
3536,Nah,0
3993,Inko hospital bejo..ye mentally hille hue log han,0
1412,"Self harm kerke body bhi NH banti kharab hojati hai Banda kamzor hojata. Hai
ya mota hojata hai fitnh rehta shakalbhi khraab hijati hai",0
4685,рдлреЗрдорд┐рдирд┐рд╕реНрдЯ рдФрд░ рд▓рд┐рдмрд░рд▓ рд░рд╛рд╖реНрдЯреНрд░ рдХреЛ рдмрд░рдмрд╛рдж рдХрд░ рд░рд╣реЗ рд╣реИрдВред,0
2287,"[14:23](https://www.youtube.com/watch?v=J2J5ssSP5yQ&t=14m23s) wala scene ..
break the chain dude ЁЯдгЁЯдгЁЯШБЁЯСНЁЯП╗",0
5115,bahut badiya,0
5626,dislike karne waale paake dalli ranndi he,0
1451,Hahahaha,0
1293,"TUMBAAD movie  
pe view kya h bro?",0
83,thoda physically unfit hone pe nikal dete hai army mai....,0
4284,Tera 16 min Ka review dekhne se Acha BC film Dekh lu,1
2344,Bollywood beinchod ЁЯСМЁЯП╗ЁЯФе,1
2610,True bhai..,0
2412,"society soch ke aab script writer likhne baithengein????? b hai, agar tere
mein itna dimaag hai toh tu script likh.... tera channel chal hi raha hai
dusre ka accha or buda justify karke..... tera khud ka kuch creativity
bata....",0
6037,lakshay choudhary ka video dekh tu.... gand faadi teri..... fucking feminist,1
5865,dhatt teri maaki choot,1
3616,Great review sir ji jai hind,0
1308,"[11:14](https://www.youtube.com/watch?v=J2J5ssSP5yQ&t=11m14s) to
[12:00](https://www.youtube.com/watch?v=J2J5ssSP5yQ&t=12m00s) excellent points
by prateek bhai. Maza hi aa gya.",0
1121,"рдореЗ рддреЛ рдХрд╣рддрд╛ рдХрд┐ рддреВ chutiya рд╣реИ рдпреЗ рдЬреЛ рдЖрдк рдмрддрд╛ рд░рд╣реЗ рд╣реИрдВ рд╣реИ рдирд╛ рдХрд┐ рд╕рдм chutiya PA рд╣реИ рднрд╛рдИ
рд╕рдмрдХреЛ рдкрддрд╛ рд╣реИ рдХрд┐ рдореВрд╡реА рдиреЗ рдРрдХреНрдЯрд┐рдВрдЧ рд╣реА рд╣реЛрддреА рд╣реИ рдЗрд╕ рдореЗ рдХреЛрдИ рдирдИ рдмрд╛рдд рдирд╣реАрдВ рд╣реИ рдЗрд╕ рд╡реАрдбрд┐рдпреЛ
рдореЗрдВ рдореБрдЭреЗ рддреЛ рддреБрдо chutiye рд▓рдЧреЗ",0
4659,Bahot der laga di bhai tune..,0
5714,jali jali feminist ki gand jali,1
552,sir plzz titanic ka movie review kijie request h plzz,0
4983,ladkiyon video,0
4569,"Feminists dharti ka bojh hein. False cases karke ladko ko fasana. Bahut hi
neech aur ghatiya hote hein feminists log.",1
5243,ekdam sahi dikhaye ho bhai. i am agree with you.,0
2326,Sb ke liye equally opportunity honi chahiye,0
4688,"Usko Pyar Ka Jhutha Khul Ke Munh Mein maarna chahie ramamandal happy Famous Ho
Gaya bol ke abhi Har aadami ko Ham kar kar raha hai sali Tera Munh Mein pura
Jhutha khol ke abhi Nikal Ke maarna chahie",0
2671,Dekhne jaata movie agar yeh bhen ki lodi actress nii hoti isme,1
355,"@vikash kumar too bhi apni jhothi bahen kp support kar raha hOAG. Tabhi tujhe
mirchi lagi.",0
1965,"Kon hai ye liberals, kaha se ate hai ye log",0
5523,"wo jasleen kaur case me b bicha ladka aisa hi fas gaya abi tak court k chakar
me uski job nhi lagi pura career barbaad ho gaya and wo ladki canada jakar
baith gai... puchne par uska lawyer bolta ki wo apna career k liye canada
shift ho gai aur wo ladka pis raha bichara...",0
2904,Apne story bata kar puri story batadi,0
888,Ek dum sahi bro,0
1766,Mansutra bhai shab mastribution kum kro kabir Khan ЁЯдг,0
5279,bhai so called feminists (faminazi) bahot gaali dene waale hai tumko,0
5140,finally kuch acha horaha hai ab,0
4843,"Hahaha me bhi ek nari hu, aur mene ye movie 1st day 1st show dekha tha, aur
aaj tak mere dimag se nei nikla raha he, itna accha tha ye movie, yesa
boyfriend kisko nei chahiye..",0
1651,"Kabir singh me dikhaya h sex is not love jab vo dusari heroine usse sex karte
waqt I love you bolti hai tab vo usse vahi choda kar chal deta hai vahi se
pata chalta hai ki vo kitna commited hai preeti se and jab do log kisi se
pyaar karte to unki understand hum nahi samjh nahi sakte mere dost aur uski
girlfriend kitna ladte par baad me panch up ho jata hai",0
501,"or ha wo Grey shirt wala uncle khrha h ki ye hmara culture ni h. to kya hmara
culture apne bchho ko jaan se marna h agr wo homo ho jaye to !!!! hmara
culture rape krna h !! bolo... agr culture ko itna mnate ho to ... ye jeans.
shirt or ye wrist watch mt phno ...... dhoti kurta me aa jao..... Culture
mante ho to Achhaiyo ko follow kro...",0
1148,Arundhati tere gaand mein goli padi hai kabhi..,1
981,Is laore movie ki wajese break up hojaega mera,0
4280,GAURAV REPLY DO,0
3506,**Preety ki koi best friend nhi thi isi liye wo dono last me ek ho paye**,0
5511,"iss video ko dislike karne wale 621 log chutiye hain . jaise women k liye laws
hain waise men's safety or fraud allegation lagane ke liye bhi law lagoo kar
dena chahiye",0
1280,Bhai film bahut acchi he,0
373,jay shree ram,0
3233,Ghussa hai bhai Arundhati Roy ka,0
1006,Bhai kabir sing dekhi aur video bana daali,0
3620,Sanket bhai ka video dekh lo ahayad aap ko knowledge aa jaye thodi jyada hi.,0
2050,San kalyug khi Maya hain,0
3846,Right jise tum,0
4073,@Aishwary Tiwari dude uski pasand hai wo konsabi pasand karsakta hai,0
1979,Bhai Dark season 2 ka review karna,0
4944,@Truthshallsetyoufree bhadwa giri shuru mat kar idhar,0
2237,"@Soumya Ranjan Sahoo Abhishek bachhan bhut achhe actor Hain unhone ""khelein
hum jee Jaan se""bhut hi achhi thi surjya sen par thi Maine surjya sen ka naam
USI film SE Jana ye movie 2010mein release hui thi lkin deki Maine 2015
mein.Unki film raavan,run,bluff master,run,games,guru,etc masterpiece Hain.Wo
agar Kisi movie mei supporting role v krte Hain Tou wo usme bhut achhi acting
de jate hain Jo logon dwara unnoticed reh jati hai.Haan unse log amitabh
bachhan jaisi acting expect krne lage jis Karan unhe apni ek alag pehchan
bnane Ka mouka NHI Mila jis trah tiger shroff KO mila.Tiger shroff,Varun
dhawan ki bekar content wali movie v rhegi Tou wo 100 crore chutki mein par
Kar jati hai Jaise kalank.",0
724,Gujrat me kaha,0
5751,ek km kr lund lele randi ki bacchi saaali kutiya khi ki,1
4431,arundhati roy ko chodne mein bohot mja aayega,1
4351,"ЁЯШВЁЯШВЁЯШВЁЯШВ  
  
  
Hut Ragdo ,,,, Piche Dalwaao.........377",1
479,рдУ рд╕реНрддреНрд░реА friendship karogi ЁЯдгЁЯдг,0
1734,Sai hay bhai,0
2211,Kisne abhi tak dekhi bhi nahi like,0
5238,metoo wala kand same hain bhai...,0
4677,Jio dadaЁЯСНЁЯСНЁЯСНЁЯТпЁЯТп,0
966,"Hme marne wala chahiye saiyan ki tarah khud ki marwane wala nahi karna Johar
ki tarah",1
114,**Kabir Singh movie bilkul bhi** **practical life se related nhi hai**,0
1225,Tu tu chutiyaa hai,0
5868,randi rona randi ro rhi he,1
951,"Film me ek talented doctor ko tharki nashedi gunda or ek sanskari ladki ki
chudai or kuchh nahi ha",1
2811,Jab tak hindustan me Sanima hai.. Log chutiye bante rahenge,0
6005,"esk muh pe gobar maaro or esko karan johar k clg se utha k real clg m lak bc
ye sb hota h ЁЯдгЁЯдгЁЯдгЁЯдгesne aaj tk karan johar ki movie dkhi h bs bc jis clg m padai
k alwa sb kuch hota h maaro esk muh pe gobar ЁЯШВЁЯШВЁЯдг",1
4749,"Din ka average 2  
ЁЯШВЁЯШВЁЯШВЁЯСН",0
726,"Me iske itne saare videos Dekh chuka Hu but still I don't understand ye Ladki
banke kyu ATA he ? Bhai ladka bane rehne me kya dikkat he ?",0
4240,Film bekar hai,0
1992,Aam public ka scooter aur car jalana masaallah kya Sanskar hai,0
1888,"sale mc usko fhirse bula or Jute marke interview lee . 2 paise ki aurat hoke
itni bari bari bate karti hey bc",1
3348,"Movie dekhne se log sikhte he.... To bhaiya fir to joker se bhi
sikhenge....... Wo bhi bekar movie huyi...... Log maarne lg jayenge frustrated
hokar....... Fir wo kese masterpiece huyi???",0
6060,"ya 1 asi randyha jo flim dekh ka lifema apply kartika....ja ba randy hollywood
movie dekh gand phatagi nahi gand phatka girjayagi",1
2154,"рддреБрдо рдХрдЯреБрдУ рдХреЛ рдмреАрдЬреЗрдкреА рд╕реЗ рдХреНрдпрд╛ рдкрд░реЗрд╢рд╛рдиреА рд╣реИ,рд╡реЛ рд╣рдо рд╕рдордЭ рд╕рдХрддреЗ рд╣реИ",0
2187,"Pratik borade sucks.. Andhbhakt.. He nvr watch a movie as movie.. Sahi film
mein secularism.. Liberals etc aisa kuch gused'deta hey",1
955,"Kya strawman ka rayta failaya hua hai, kuchh bhi....  
Kisi ko ye movie pasand nahi aayi to wo aatankwadiyo ka supporter hai, Abe
chutiyape ki bhi limit hoti hai.",0
5359,"yeh tho whi baat ho gyi ki sher aaya sher aaya phir saach mein sher aayega tho
koi bachane nhi aayega..! suicide karo or new life shuru karoЁЯШВ",0
6167,"teri maa ki chut bhsdke most disliked video hogi chuttar uthake a jata hain
bhsdke",1
5572,"rape krne valo ka chehra dikhaya jata hai.  
 **jhuta case dalne vali ka bhi chehra dikhana chahiye. ya fir use 14 sal jail
honi chahiye.**  
dono mese koi ek hona chahiye.!!!",0
2833,Bhi jan Tik tok bare me mesg do,0
2305,Saabaash Sher,0
6051,a kisne review kiya film ko madarchod,1
1549,bilkul nahi hone sahie unlogoki banduke hamesa galat jageh par goli marte Hai,0
2310,Bhaio ye video bollywood tak pahochna chahiye or ankhe khulni chahiye ЁЯСНЁЯСНЁЯСН,0
4281,Akshay Khanna is perfect in his acting always ЁЯСМ,0
1672,"Ye liberals and Feminists ki baat aap kar rahe ho vo Film Companion ka review
hain...saale dogleЁЯШПЁЯШП",0
1116,filmy news upasna mam se sunna achha lgta hai,0
2431,Banduk chalane k bajae apne hi daal lenge,0
1956,"Sahi h bhai ""dost ko pata hi ni chalta ki chutiye ko koi matlab ni h usse""",0
3684,Same review tha Mera v movie dekhne k bad,0
1170,Bhot sahi bhie i love you,0
2906,"Religion devlopment рдХреЛ рд░реЛрдХрддрд╛ рд╣реИ,рдЗрд╕реЗ рднрд╛рд░рдд рд╕реЗ рдЦрддреНрдо рдХрд░рдирд╛ рд╣реЛрдЧрд╛ рд╣реАреЗредрдЗрд╕рдХреЗ рдХрд╛рд░рдг рд╣рдо рдПрдХ
рджреВрд╕рд░реЗ рдХреЛ рдиреАрдЪреЗ рдЧрд┐рд░рдиреЗ рдкрд░ рджрд┐рдорд╛рдЧ рдФрд░ energy рд▓рдЧрд╛рддреЗ рд╣реИ,рди рдХреА рдЦреБрджрдХреЗ рд╡рд┐рдХрд╛рд╕ рдФрд░ рдЖрд░реНрдерд┐рдХ
рдордЬрд╝рдмреВрддреА рдкрд░редрдЦрд╛рд╕рдХреЗ muslims рдХреЛ рд╕рдордЭрдирд╛ рд╣реЛрдЧрд╛редрд╣рдореЗ рднрд╛рд░рдд рдХреЛ рдЖрд░реНрдерд┐рдХ рдордЬрд╝рдмреВрддреА рджреЗрдиреА рд╣реА
рд╣реЛрдЧреА,рд╡рд╛рд░реНрдирд╛ рд╣рдо рдЗрд╕ рдЪрдХреНрдХрд░ рдореЗрдВ рдмрд░реНрдмрд╛рдж рд╣реЛ рдЬрд╛рдПрдВрдЧреЗредрдЪреАрди рдиреЗ рдЗрд╕реА рдХрд╛рд░рдг religion рд╣рдЯрд╛
рджрд┐рдпрд╛,рдкреНрд▓реАрдЬ рд╣рдореЗ рдЗрд╕ рджреЗрд╢ рд╕реЗ рд╕рднреА religion рд╣рдЯрд╛рдирд╛ рд╣реА рд╣реЛрдЧрд╛,рддрднреА unlimited progress
рд╣реЛрдЧреА рд╡рд╛рд░реНрдирд╛ рд╕рд┐рдордЯ рдХреЗ рд░рд╣ рдЬрд╛рдпреЗрдЧреЗ,рдФрд░ рдЪреАрди рджреБрдирд┐рдпрд╛ рдкрд░ рд░рд╛рдЬ рдХрд░реЗрдЧрд╛,рддрдм рд╣рдо рдЦреБрджрдХреА рдЧрд▓рддреА рдХрд╛
рдЕрд╣рд╕рд╛рд╕ рдХрд░реЗрдЧреЗ,рдФрд░ рдиреМрдХрд░ рди рдмрдиреЗ рдЗрд╕рд▓рд┐рдпреЗ рдкреНрд▓реАрдЬ рднрд╛рд░рдд рд╕реЗ рд░рд┐рд▓рд┐рдЬрди рдЦрддреНрдо рдХрд░,рдФрд░ рдЖрд░реНрдерд┐рдХ
рдордЬрд╝рдмреВрддреА рд▓рд╛рдпреЗ рддреЗрдЬрд╝реА рд╕реЗ quality education,innovationрдФрд░ skill development рдХреЗ
рдЬрд░рд┐рдпреЗредрд╕рдордЭрджрд╛рд░ рдмрдиреЗред",0
4672,"Movie Entertainment k liye dekho na itna lauda lassan dhoondhna he kiu hy
sidha movie dekho maza aya baat khallas abb meri life ki real story koi
theatre mey lgayega toh lauda dekhne ayega..lkin problem yh hy k yh bewakoof
log movies ko real samjh byhthe hy",1
3989,Maine itni kam dislike kbhi nhii dekhi,0
4712,"Bhai, fir to shayad aapko Feminism ke Naam pe duniya me kya chal Raha hai pata
hi nahi hai !  
Feminism, Liberalism ye words aaj ek gali ban chuke hai !  
Aur thank you so much mujhe Judge karne ke liye... Aise hi Dusron Ko judge
karte rahiye ЁЯСН",0
1644,"Ha Indian culture is rape karna fir murder karna. Education makes intelligent.
Why are you asking to those gawar jaahil uneducated people ? Jaahil logo ka
baat sunke hi dimaag garam ho jata hai.. koi point nehi matlab nehi bewakoof
bass bolte hai.. There is nothing called INDIAN CULTURE hum jo karenge or
sochenge wahi culture banega in future.",0
4926,"Siddharth apni maa ko chod aaj, fir feminist ki baat kar bc. ЁЯШВ",1
3495,"Reet Kaur Subscribe Channel, Madam woh itihaas ban chuka hai par aaj ke ranga
billa jo kar rahe hain uske baare mein mooh kholo aur sach ko accept karo ki
[#RangaBillaAmitModi](http://www.youtube.com/results?search_query=%23RangaBillaAmitModi)
bhi mujrim hai bekasooron ka khoon bahane mein.",0
4496,"Bhaiiii.....BC.....mujhe aasa dost chahiye Yaar.....Varna my iski tarha
banke.....kaafi longonka best friend banjavunga.....ЁЯШД",0
3295,ye toh bhai iss ne bikul sahi kiya,0
1548,Etna yo trailer dekh k hi pta cl gya tha ....ji,0
839,Bhai spoiler alert dal dete,0
2280,bohat assa laga,0
5234,"bhai meri toh gand fatni lagai inse ma aas paas nhi bakta aab. gand mariye ye
ladkiya",1
5938,"nikal loddi ..  
pheli fursat me nikal ..  
koi jrurat nhi tere review ki ..  
mc tatti ki skl ki ...  
chl mc ..",1
3798,"[8:10](https://www.youtube.com/watch?v=N_ZMfQMZos0&t=8m10s) khatm bhai pyaar
hogyaaaЁЯШВ",0
1061,Abe bsdk ke pehle pudia thuk ke aa,1
4120,Ye army chief ko shobha nahi deta,0
4439,Achi movie heЁЯШО aj dekha mene,0
475,"sir aap plz feminism ke karan tension nahi lijiye.....feminism jis rahh pe
chal rahi hai....wo apna kabr khud khod rahi hai...ager mere nazariye se dekhe
to jald hi feminism ko counter kerne ke liye phir nayi thought
aayegi......bicharo ki hi to ye ladai hai....",0
